{
 "name": "Aufwachen",
 "type": "public_channel",
 "id": 9683270591,
 "messages": [
  {
   "id": 1,
   "type": "service",
   "date": "2016-11-26T12:50:17",
   "actor": "Aufwachen",
   "actor_id": 9683270591,
   "action": "create_channel",
   "title": "Aufwachen",
   "text": ""
  },
  {
   "id": 2,
   "type": "service",
   "date": "2016-11-26T12:51:52",
   "actor": "Aufwachen",
   "actor_id": 9683270591,
   "action": "edit_group_photo",
   "photo": "photos/photo_1@26-11-2016_12-51-52.jpg",
   "width": 640,
   "height": 640,
   "text": ""
  },
  {
   "id": 3,
   "type": "message",
   "date": "2016-11-26T12:52:22",
   "from": "Aufwachen",
   "from_id": 9683270591,
   "photo": "photos/photo_2@26-11-2016_12-52-22.jpg",
   "width": 620,
   "height": 720,
   "text": ""
  },
  {
   "id": 4,
   "type": "message",
   "date": "2016-11-26T12:52:43",
   "from": "Aufwachen",
   "from_id": 9683270591,
   "photo": "photos/photo_3@26-11-2016_12-52-43.jpg",
   "width": 602,
   "height": 592,
   "text": ""
  },
  {
   "id": 5,
   "type": "message",
   "date": "2016-11-26T12:57:07",
   "from": "Aufwachen",
   "from_id": 9683270591,
   "photo": "photos/photo_4@26-11-2016_12-57-07.jpg",
   "width": 720,
   "height": 480,
   "text": ""
  },
  {
   "id": 6,
   "type": "message",
   "date": "2016-11-26T12:57:20",
   "from": "Aufwachen",
   "from_id": 9683270591,
   "photo": "photos/photo_5@26-11-2016_12-57-20.jpg",
   "width": 460,
   "height": 604,
   "text": ""
  },
  {
   "id": 7,
   "type": "message",
   "date": "2016-11-26T12:57:38",
   "from": "Aufwachen",
   "from_id": 9683270591,
   "photo": "photos/photo_6@26-11-2016_12-57-38.jpg",
   "width": 642,
   "height": 556,
   "text": ""
  },
  {
   "id": 8,
   "type": "message",
   "date": "2016-11-26T12:58:00",
   "from": "Aufwachen",
   "from_id": 9683270591,
   "photo": "photos/photo_7@26-11-2016_12-58-00.jpg",
   "width": 676,
   "height": 647,
   "text": ""
  },
  {
   "id": 9,
   "type": "message",
   "date": "2016-11-26T13:01:18",
   "from": "Aufwachen",
   "from_id": 9683270591,
   "photo": "photos/photo_8@26-11-2016_13-01-18.jpg",
   "width": 693,
   "height": 696,
   "text": ""
  },
  {
   "id": 10,
   "type": "message",
   "date": "2016-11-26T13:01:39",
   "from": "Aufwachen",
   "from_id": 9683270591,
   "photo": "photos/photo_9@26-11-2016_13-01-39.jpg",
   "width": 720,
   "height": 498,
   "text": ""
  },
  {
   "id": 11,
   "type": "message",
   "date": "2016-11-26T13:01:51",
   "from": "Aufwachen",
   "from_id": 9683270591,
   "photo": "photos/photo_10@26-11-2016_13-01-51.jpg",
   "width": 510,
   "height": 343,
   "text": ""
  },
  {
   "id": 12,
   "type": "message",
   "date": "2016-11-26T13:02:40",
   "from": "Aufwachen",
   "from_id": 9683270591,
   "photo": "photos/photo_11@26-11-2016_13-02-40.jpg",
   "width": 720,
   "height": 455,
   "text": ""
  },
  {
   "id": 13,
   "type": "message",
   "date": "2016-11-26T13:03:57",
   "from": "Aufwachen",
   "from_id": 9683270591,
   "photo": "photos/photo_12@26-11-2016_13-03-57.jpg",
   "width": 539,
   "height": 960,
   "text": ""
  },
  {
   "id": 14,
   "type": "message",
   "date": "2016-11-26T13:05:08",
   "from": "Aufwachen",
   "from_id": 9683270591,
   "photo": "photos/photo_13@26-11-2016_13-05-08.jpg",
   "width": 296,
   "height": 296,
   "text": ""
  },
  {
   "id": 15,
   "type": "message",
   "date": "2016-11-26T13:05:30",
   "from": "Aufwachen",
   "from_id": 9683270591,
   "photo": "photos/photo_14@26-11-2016_13-05-30.jpg",
   "width": 972,
   "height": 972,
   "text": ""
  },
  {
   "id": 16,
   "type": "message",
   "date": "2016-11-26T13:05:55",
   "from": "Aufwachen",
   "from_id": 9683270591,
   "photo": "photos/photo_15@26-11-2016_13-05-55.jpg",
   "width": 512,
   "height": 640,
   "text": ""
  },
  {
   "id": 17,
   "type": "message",
   "date": "2016-11-26T13:06:18",
   "from": "Aufwachen",
   "from_id": 9683270591,
   "photo": "photos/photo_16@26-11-2016_13-06-18.jpg",
   "width": 720,
   "height": 695,
   "text": ""
  },
  {
   "id": 18,
   "type": "message",
   "date": "2016-11-26T13:08:17",
   "from": "Aufwachen",
   "from_id": 9683270591,
   "photo": "photos/photo_17@26-11-2016_13-08-17.jpg",
   "width": 500,
   "height": 375,
   "text": ""
  },
  {
   "id": 19,
   "type": "message",
   "date": "2016-11-26T13:09:49",
   "from": "Aufwachen",
   "from_id": 9683270591,
   "photo": "photos/photo_18@26-11-2016_13-09-49.jpg",
   "width": 480,
   "height": 853,
   "text": ""
  },
  {
   "id": 20,
   "type": "message",
   "date": "2016-11-26T13:13:59",
   "from": "Aufwachen",
   "from_id": 9683270591,
   "photo": "photos/photo_19@26-11-2016_13-13-59.jpg",
   "width": 640,
   "height": 913,
   "text": ""
  },
  {
   "id": 21,
   "type": "message",
   "date": "2016-11-26T13:17:31",
   "from": "Aufwachen",
   "from_id": 9683270591,
   "photo": "photos/photo_20@26-11-2016_13-17-31.jpg",
   "width": 503,
   "height": 503,
   "text": ""
  },
  {
   "id": 22,
   "type": "message",
   "date": "2016-11-26T13:31:35",
   "from": "Aufwachen",
   "from_id": 9683270591,
   "photo": "photos/photo_21@26-11-2016_13-31-35.jpg",
   "width": 720,
   "height": 1016,
   "text": ""
  },
  {
   "id": 23,
   "type": "message",
   "date": "2016-11-26T13:32:40",
   "from": "Aufwachen",
   "from_id": 9683270591,
   "photo": "photos/photo_22@26-11-2016_13-32-40.jpg",
   "width": 506,
   "height": 506,
   "text": ""
  },
  {
   "id": 24,
   "type": "message",
   "date": "2016-11-26T13:34:50",
   "from": "Aufwachen",
   "from_id": 9683270591,
   "photo": "photos/photo_23@26-11-2016_13-34-50.jpg",
   "width": 576,
   "height": 766,
   "text": ""
  },
  {
   "id": 25,
   "type": "message",
   "date": "2016-11-26T13:36:03",
   "from": "Aufwachen",
   "from_id": 9683270591,
   "photo": "photos/photo_24@26-11-2016_13-36-03.jpg",
   "width": 640,
   "height": 687,
   "text": ""
  },
  {
   "id": 26,
   "type": "message",
   "date": "2016-11-26T13:37:29",
   "from": "Aufwachen",
   "from_id": 9683270591,
   "photo": "photos/photo_25@26-11-2016_13-37-29.jpg",
   "width": 720,
   "height": 672,
   "text": ""
  },
  {
   "id": 27,
   "type": "message",
   "date": "2016-11-26T13:45:39",
   "from": "Aufwachen",
   "from_id": 9683270591,
   "photo": "photos/photo_26@26-11-2016_13-45-39.jpg",
   "width": 720,
   "height": 688,
   "text": ""
  },
  {
   "id": 28,
   "type": "message",
   "date": "2016-11-26T13:48:57",
   "from": "Aufwachen",
   "from_id": 9683270591,
   "photo": "photos/photo_27@26-11-2016_13-48-57.jpg",
   "width": 599,
   "height": 720,
   "text": ""
  },
  {
   "id": 29,
   "type": "message",
   "date": "2016-11-26T14:01:41",
   "from": "Aufwachen",
   "from_id": 9683270591,
   "photo": "photos/photo_28@26-11-2016_14-01-41.jpg",
   "width": 720,
   "height": 738,
   "text": ""
  },
  {
   "id": 30,
   "type": "message",
   "date": "2016-11-26T14:03:52",
   "from": "Aufwachen",
   "from_id": 9683270591,
   "photo": "photos/photo_29@26-11-2016_14-03-52.jpg",
   "width": 720,
   "height": 720,
   "text": ""
  },
  {
   "id": 31,
   "type": "message",
   "date": "2016-11-26T14:07:13",
   "from": "Aufwachen",
   "from_id": 9683270591,
   "photo": "photos/photo_30@26-11-2016_14-07-13.jpg",
   "width": 480,
   "height": 778,
   "text": ""
  },
  {
   "id": 32,
   "type": "service",
   "date": "2016-11-26T14:20:06",
   "actor": "Aufwachen",
   "actor_id": 9683270591,
   "action": "edit_group_photo",
   "photo": "photos/photo_31@26-11-2016_14-20-06.jpg",
   "width": 640,
   "height": 640,
   "text": ""
  },
  {
   "id": 33,
   "type": "message",
   "date": "2016-11-26T14:33:40",
   "from": "Aufwachen",
   "from_id": 9683270591,
   "photo": "photos/photo_32@26-11-2016_14-33-40.jpg",
   "width": 720,
   "height": 720,
   "text": ""
  },
  {
   "id": 34,
   "type": "message",
   "date": "2016-11-26T14:34:08",
   "from": "Aufwachen",
   "from_id": 9683270591,
   "photo": "photos/photo_33@26-11-2016_14-34-08.jpg",
   "width": 667,
   "height": 667,
   "text": ""
  },
  {
   "id": 35,
   "type": "message",
   "date": "2016-11-26T14:35:02",
   "from": "Aufwachen",
   "from_id": 9683270591,
   "photo": "photos/photo_34@26-11-2016_14-35-02.jpg",
   "width": 560,
   "height": 560,
   "text": ""
  },
  {
   "id": 36,
   "type": "message",
   "date": "2016-11-26T14:35:17",
   "from": "Aufwachen",
   "from_id": 9683270591,
   "photo": "photos/photo_35@26-11-2016_14-35-17.jpg",
   "width": 720,
   "height": 715,
   "text": ""
  },
  {
   "id": 37,
   "type": "message",
   "date": "2016-11-26T14:35:31",
   "from": "Aufwachen",
   "from_id": 9683270591,
   "photo": "photos/photo_36@26-11-2016_14-35-31.jpg",
   "width": 618,
   "height": 916,
   "text": ""
  },
  {
   "id": 38,
   "type": "message",
   "date": "2016-11-26T14:37:58",
   "from": "Aufwachen",
   "from_id": 9683270591,
   "photo": "photos/photo_37@26-11-2016_14-37-58.jpg",
   "width": 720,
   "height": 634,
   "text": ""
  },
  {
   "id": 39,
   "type": "message",
   "date": "2016-11-26T14:38:24",
   "from": "Aufwachen",
   "from_id": 9683270591,
   "photo": "photos/photo_38@26-11-2016_14-38-24.jpg",
   "width": 577,
   "height": 577,
   "text": ""
  },
  {
   "id": 41,
   "type": "message",
   "date": "2016-11-26T15:47:02",
   "from": "Aufwachen",
   "from_id": 9683270591,
   "photo": "photos/photo_39@26-11-2016_15-47-02.jpg",
   "width": 720,
   "height": 581,
   "text": ""
  },
  {
   "id": 42,
   "type": "message",
   "date": "2016-11-26T15:47:58",
   "from": "Aufwachen",
   "from_id": 9683270591,
   "photo": "photos/photo_40@26-11-2016_15-47-58.jpg",
   "width": 700,
   "height": 700,
   "text": ""
  },
  {
   "id": 43,
   "type": "message",
   "date": "2016-11-26T15:50:22",
   "from": "Aufwachen",
   "from_id": 9683270591,
   "file": "video_files/video_1@26-11-2016_15-50-22.mp4",
   "thumbnail": "video_files/video_1@26-11-2016_15-50-22.mp4_thumb.jpg",
   "media_type": "video_file",
   "mime_type": "video/mp4",
   "duration_seconds": 34,
   "width": 400,
   "height": 226,
   "text": ""
  },
  {
   "id": 44,
   "type": "message",
   "date": "2016-11-26T16:45:58",
   "from": "Aufwachen",
   "from_id": 9683270591,
   "photo": "photos/photo_41@26-11-2016_16-45-58.jpg",
   "width": 720,
   "height": 507,
   "text": ""
  },
  {
   "id": 45,
   "type": "message",
   "date": "2016-11-26T18:14:34",
   "from": "Aufwachen",
   "from_id": 9683270591,
   "photo": "photos/photo_42@26-11-2016_18-14-34.jpg",
   "width": 720,
   "height": 714,
   "text": ""
  },
  {
   "id": 46,
   "type": "message",
   "date": "2016-11-26T18:14:51",
   "from": "Aufwachen",
   "from_id": 9683270591,
   "photo": "photos/photo_43@26-11-2016_18-14-51.jpg",
   "width": 661,
   "height": 800,
   "text": ""
  },
  {
   "id": 47,
   "type": "message",
   "date": "2016-11-26T19:14:46",
   "from": "Aufwachen",
   "from_id": 9683270591,
   "file": "video_files/video_2@26-11-2016_19-14-46.mp4",
   "thumbnail": "video_files/video_2@26-11-2016_19-14-46.mp4_thumb.jpg",
   "media_type": "video_file",
   "mime_type": "video/mp4",
   "duration_seconds": 44,
   "width": 204,
   "height": 360,
   "text": ""
  },
  {
   "id": 48,
   "type": "message",
   "date": "2016-11-26T19:17:07",
   "from": "Aufwachen",
   "from_id": 9683270591,
   "photo": "photos/photo_44@26-11-2016_19-17-07.jpg",
   "width": 720,
   "height": 873,
   "text": ""
  },
  {
   "id": 49,
   "type": "message",
   "date": "2016-11-26T19:25:28",
   "from": "Aufwachen",
   "from_id": 9683270591,
   "photo": "photos/photo_45@26-11-2016_19-25-28.jpg",
   "width": 720,
   "height": 720,
   "text": ""
  },
  {
   "id": 51,
   "type": "message",
   "date": "2016-11-26T20:46:05",
   "from": "Aufwachen",
   "from_id": 9683270591,
   "photo": "photos/photo_46@26-11-2016_20-46-05.jpg",
   "width": 480,
   "height": 475,
   "text": ""
  },
  {
   "id": 53,
   "type": "message",
   "date": "2016-11-26T23:09:49",
   "from": "Aufwachen",
   "from_id": 9683270591,
   "photo": "photos/photo_47@26-11-2016_23-09-49.jpg",
   "width": 720,
   "height": 686,
   "text": ""
  },
  {
   "id": 54,
   "type": "message",
   "date": "2016-11-26T23:39:46",
   "from": "Aufwachen",
   "from_id": 9683270591,
   "photo": "photos/photo_48@26-11-2016_23-39-46.jpg",
   "width": 720,
   "height": 720,
   "text": ""
  },
  {
   "id": 55,
   "type": "message",
   "date": "2016-11-26T23:42:52",
   "from": "Aufwachen",
   "from_id": 9683270591,
   "photo": "photos/photo_49@26-11-2016_23-42-52.jpg",
   "width": 707,
   "height": 546,
   "text": ""
  },
  {
   "id": 56,
   "type": "message",
   "date": "2016-11-26T23:47:42",
   "from": "Aufwachen",
   "from_id": 9683270591,
   "photo": "photos/photo_50@26-11-2016_23-47-42.jpg",
   "width": 720,
   "height": 493,
   "text": ""
  },
  {
   "id": 57,
   "type": "message",
   "date": "2016-11-27T10:06:00",
   "from": "Aufwachen",
   "from_id": 9683270591,
   "photo": "photos/photo_51@27-11-2016_10-06-00.jpg",
   "width": 479,
   "height": 480,
   "text": ""
  },
  {
   "id": 58,
   "type": "message",
   "date": "2016-11-27T10:07:26",
   "from": "Aufwachen",
   "from_id": 9683270591,
   "photo": "photos/photo_52@27-11-2016_10-07-26.jpg",
   "width": 656,
   "height": 656,
   "text": ""
  },
  {
   "id": 59,
   "type": "message",
   "date": "2016-11-27T10:08:21",
   "from": "Aufwachen",
   "from_id": 9683270591,
   "photo": "photos/photo_53@27-11-2016_10-08-21.jpg",
   "width": 720,
   "height": 720,
   "text": ""
  },
  {
   "id": 60,
   "type": "message",
   "date": "2016-11-27T10:09:12",
   "from": "Aufwachen",
   "from_id": 9683270591,
   "photo": "photos/photo_54@27-11-2016_10-09-12.jpg",
   "width": 720,
   "height": 720,
   "text": ""
  },
  {
   "id": 61,
   "type": "message",
   "date": "2016-11-27T10:09:29",
   "from": "Aufwachen",
   "from_id": 9683270591,
   "photo": "photos/photo_55@27-11-2016_10-09-29.jpg",
   "width": 720,
   "height": 720,
   "text": ""
  },
  {
   "id": 62,
   "type": "message",
   "date": "2016-11-27T10:09:56",
   "from": "Aufwachen",
   "from_id": 9683270591,
   "photo": "photos/photo_56@27-11-2016_10-09-56.jpg",
   "width": 720,
   "height": 613,
   "text": ""
  },
  {
   "id": 63,
   "type": "message",
   "date": "2016-11-27T10:25:54",
   "from": "Aufwachen",
   "from_id": 9683270591,
   "photo": "photos/photo_57@27-11-2016_10-25-54.jpg",
   "width": 682,
   "height": 960,
   "text": ""
  },
  {
   "id": 64,
   "type": "message",
   "date": "2016-11-27T11:06:36",
   "from": "Aufwachen",
   "from_id": 9683270591,
   "photo": "photos/photo_58@27-11-2016_11-06-36.jpg",
   "width": 720,
   "height": 534,
   "text": ""
  },
  {
   "id": 65,
   "type": "message",
   "date": "2016-11-27T17:13:19",
   "from": "Aufwachen",
   "from_id": 9683270591,
   "photo": "photos/photo_59@27-11-2016_17-13-19.jpg",
   "width": 500,
   "height": 678,
   "text": ""
  },
  {
   "id": 66,
   "type": "message",
   "date": "2016-11-27T17:45:31",
   "from": "Aufwachen",
   "from_id": 9683270591,
   "photo": "photos/photo_60@27-11-2016_17-45-31.jpg",
   "width": 720,
   "height": 720,
   "text": ""
  },
  {
   "id": 67,
   "type": "message",
   "date": "2016-11-27T17:46:45",
   "from": "Aufwachen",
   "from_id": 9683270591,
   "photo": "photos/photo_61@27-11-2016_17-46-45.jpg",
   "width": 480,
   "height": 319,
   "text": ""
  },
  {
   "id": 68,
   "type": "message",
   "date": "2016-11-27T17:47:23",
   "from": "Aufwachen",
   "from_id": 9683270591,
   "photo": "photos/photo_62@27-11-2016_17-47-23.jpg",
   "width": 720,
   "height": 471,
   "text": ""
  },
  {
   "id": 69,
   "type": "message",
   "date": "2016-11-27T17:48:00",
   "from": "Aufwachen",
   "from_id": 9683270591,
   "photo": "photos/photo_63@27-11-2016_17-48-00.jpg",
   "width": 472,
   "height": 324,
   "text": ""
  },
  {
   "id": 70,
   "type": "message",
   "date": "2016-11-27T20:40:24",
   "from": "Aufwachen",
   "from_id": 9683270591,
   "photo": "photos/photo_64@27-11-2016_20-40-24.jpg",
   "width": 471,
   "height": 600,
   "text": ""
  },
  {
   "id": 71,
   "type": "message",
   "date": "2016-11-28T06:51:22",
   "from": "Aufwachen",
   "from_id": 9683270591,
   "photo": "photos/photo_65@28-11-2016_06-51-22.jpg",
   "width": 564,
   "height": 564,
   "text": ""
  },
  {
   "id": 72,
   "type": "message",
   "date": "2016-11-28T13:37:49",
   "from": "Aufwachen",
   "from_id": 9683270591,
   "photo": "photos/photo_66@28-11-2016_13-37-49.jpg",
   "width": 720,
   "height": 450,
   "text": ""
  },
  {
   "id": 73,
   "type": "message",
   "date": "2016-11-28T14:25:50",
   "from": "Aufwachen",
   "from_id": 9683270591,
   "photo": "photos/photo_67@28-11-2016_14-25-50.jpg",
   "width": 720,
   "height": 687,
   "text": ""
  },
  {
   "id": 74,
   "type": "message",
   "date": "2016-11-28T15:51:05",
   "from": "Aufwachen",
   "from_id": 9683270591,
   "photo": "photos/photo_68@28-11-2016_15-51-05.jpg",
   "width": 720,
   "height": 720,
   "text": ""
  },
  {
   "id": 75,
   "type": "message",
   "date": "2016-11-28T15:52:20",
   "from": "Aufwachen",
   "from_id": 9683270591,
   "photo": "photos/photo_69@28-11-2016_15-52-20.jpg",
   "width": 720,
   "height": 720,
   "text": ""
  },
  {
   "id": 76,
   "type": "message",
   "date": "2016-11-28T15:55:43",
   "from": "Aufwachen",
   "from_id": 9683270591,
   "photo": "photos/photo_70@28-11-2016_15-55-43.jpg",
   "width": 480,
   "height": 480,
   "text": ""
  },
  {
   "id": 77,
   "type": "message",
   "date": "2016-11-28T15:56:15",
   "from": "Aufwachen",
   "from_id": 9683270591,
   "photo": "photos/photo_71@28-11-2016_15-56-15.jpg",
   "width": 480,
   "height": 598,
   "text": ""
  },
  {
   "id": 78,
   "type": "message",
   "date": "2016-11-28T18:26:01",
   "from": "Aufwachen",
   "from_id": 9683270591,
   "photo": "photos/photo_72@28-11-2016_18-26-01.jpg",
   "width": 720,
   "height": 720,
   "text": ""
  },
  {
   "id": 79,
   "type": "message",
   "date": "2016-11-28T18:31:00",
   "from": "Aufwachen",
   "from_id": 9683270591,
   "photo": "photos/photo_73@28-11-2016_18-31-00.jpg",
   "width": 520,
   "height": 412,
   "text": ""
  },
  {
   "id": 80,
   "type": "message",
   "date": "2016-11-28T19:08:09",
   "from": "Aufwachen",
   "from_id": 9683270591,
   "photo": "photos/photo_74@28-11-2016_19-08-09.jpg",
   "width": 662,
   "height": 758,
   "text": ""
  },
  {
   "id": 81,
   "type": "message",
   "date": "2016-11-28T19:09:13",
   "from": "Aufwachen",
   "from_id": 9683270591,
   "photo": "photos/photo_75@28-11-2016_19-09-13.jpg",
   "width": 720,
   "height": 507,
   "text": ""
  },
  {
   "id": 82,
   "type": "message",
   "date": "2016-11-28T19:11:08",
   "from": "Aufwachen",
   "from_id": 9683270591,
   "photo": "photos/photo_76@28-11-2016_19-11-08.jpg",
   "width": 720,
   "height": 822,
   "text": ""
  },
  {
   "id": 83,
   "type": "message",
   "date": "2016-11-28T20:14:29",
   "from": "Aufwachen",
   "from_id": 9683270591,
   "photo": "photos/photo_77@28-11-2016_20-14-29.jpg",
   "width": 720,
   "height": 720,
   "text": ""
  },
  {
   "id": 84,
   "type": "message",
   "date": "2016-11-28T20:16:10",
   "from": "Aufwachen",
   "from_id": 9683270591,
   "photo": "photos/photo_78@28-11-2016_20-16-10.jpg",
   "width": 528,
   "height": 522,
   "text": ""
  },
  {
   "id": 85,
   "type": "message",
   "date": "2016-11-28T20:17:50",
   "from": "Aufwachen",
   "from_id": 9683270591,
   "photo": "photos/photo_79@28-11-2016_20-17-50.jpg",
   "width": 480,
   "height": 533,
   "text": ""
  },
  {
   "id": 86,
   "type": "message",
   "date": "2016-11-28T20:19:31",
   "from": "Aufwachen",
   "from_id": 9683270591,
   "photo": "photos/photo_80@28-11-2016_20-19-31.jpg",
   "width": 460,
   "height": 449,
   "text": ""
  },
  {
   "id": 87,
   "type": "message",
   "date": "2016-11-28T20:23:37",
   "from": "Aufwachen",
   "from_id": 9683270591,
   "photo": "photos/photo_81@28-11-2016_20-23-37.jpg",
   "width": 640,
   "height": 480,
   "text": ""
  },
  {
   "id": 88,
   "type": "message",
   "date": "2016-11-28T20:25:35",
   "from": "Aufwachen",
   "from_id": 9683270591,
   "photo": "photos/photo_82@28-11-2016_20-25-35.jpg",
   "width": 720,
   "height": 378,
   "text": ""
  },
  {
   "id": 89,
   "type": "message",
   "date": "2016-11-29T06:47:17",
   "from": "Aufwachen",
   "from_id": 9683270591,
   "photo": "photos/photo_83@29-11-2016_06-47-17.jpg",
   "width": 505,
   "height": 377,
   "text": ""
  },
  {
   "id": 90,
   "type": "message",
   "date": "2016-11-29T06:47:44",
   "from": "Aufwachen",
   "from_id": 9683270591,
   "photo": "photos/photo_84@29-11-2016_06-47-44.jpg",
   "width": 640,
   "height": 960,
   "text": ""
  },
  {
   "id": 91,
   "type": "message",
   "date": "2016-11-29T09:09:30",
   "from": "Aufwachen",
   "from_id": 9683270591,
   "photo": "photos/photo_85@29-11-2016_09-09-30.jpg",
   "width": 636,
   "height": 582,
   "text": ""
  },
  {
   "id": 92,
   "type": "message",
   "date": "2016-11-29T10:40:54",
   "from": "Aufwachen",
   "from_id": 9683270591,
   "photo": "photos/photo_86@29-11-2016_10-40-54.jpg",
   "width": 480,
   "height": 296,
   "text": ""
  },
  {
   "id": 93,
   "type": "message",
   "date": "2016-11-29T12:08:37",
   "from": "Aufwachen",
   "from_id": 9683270591,
   "photo": "photos/photo_87@29-11-2016_12-08-37.jpg",
   "width": 400,
   "height": 400,
   "text": ""
  },
  {
   "id": 94,
   "type": "message",
   "date": "2016-11-29T14:21:58",
   "from": "Aufwachen",
   "from_id": 9683270591,
   "photo": "photos/photo_88@29-11-2016_14-21-58.jpg",
   "width": 480,
   "height": 447,
   "text": ""
  },
  {
   "id": 96,
   "type": "message",
   "date": "2016-11-29T15:57:54",
   "from": "Aufwachen",
   "from_id": 9683270591,
   "photo": "photos/photo_89@29-11-2016_15-57-54.jpg",
   "width": 877,
   "height": 586,
   "text": ""
  },
  {
   "id": 97,
   "type": "message",
   "date": "2016-11-29T19:25:33",
   "from": "Aufwachen",
   "from_id": 9683270591,
   "photo": "photos/photo_90@29-11-2016_19-25-33.jpg",
   "width": 480,
   "height": 480,
   "text": ""
  },
  {
   "id": 98,
   "type": "message",
   "date": "2016-11-29T22:21:01",
   "from": "Aufwachen",
   "from_id": 9683270591,
   "photo": "photos/photo_91@29-11-2016_22-21-01.jpg",
   "width": 564,
   "height": 564,
   "text": ""
  },
  {
   "id": 99,
   "type": "message",
   "date": "2016-11-29T22:35:00",
   "from": "Aufwachen",
   "from_id": 9683270591,
   "photo": "photos/photo_92@29-11-2016_22-35-00.jpg",
   "width": 720,
   "height": 713,
   "text": ""
  },
  {
   "id": 100,
   "type": "message",
   "date": "2016-11-29T22:57:24",
   "from": "Aufwachen",
   "from_id": 9683270591,
   "photo": "photos/photo_93@29-11-2016_22-57-24.jpg",
   "width": 478,
   "height": 546,
   "text": ""
  },
  {
   "id": 101,
   "type": "message",
   "date": "2016-11-29T22:59:18",
   "from": "Aufwachen",
   "from_id": 9683270591,
   "photo": "photos/photo_94@29-11-2016_22-59-18.jpg",
   "width": 720,
   "height": 653,
   "text": ""
  },
  {
   "id": 102,
   "type": "message",
   "date": "2016-11-29T23:02:51",
   "from": "Aufwachen",
   "from_id": 9683270591,
   "photo": "photos/photo_95@29-11-2016_23-02-51.jpg",
   "width": 720,
   "height": 720,
   "text": ""
  },
  {
   "id": 103,
   "type": "message",
   "date": "2016-11-29T23:06:10",
   "from": "Aufwachen",
   "from_id": 9683270591,
   "photo": "photos/photo_96@29-11-2016_23-06-10.jpg",
   "width": 552,
   "height": 443,
   "text": ""
  },
  {
   "id": 104,
   "type": "message",
   "date": "2016-11-29T23:08:21",
   "from": "Aufwachen",
   "from_id": 9683270591,
   "photo": "photos/photo_97@29-11-2016_23-08-21.jpg",
   "width": 720,
   "height": 872,
   "text": ""
  },
  {
   "id": 105,
   "type": "message",
   "date": "2016-11-29T23:12:28",
   "from": "Aufwachen",
   "from_id": 9683270591,
   "photo": "photos/photo_98@29-11-2016_23-12-28.jpg",
   "width": 636,
   "height": 635,
   "text": ""
  },
  {
   "id": 106,
   "type": "message",
   "date": "2016-11-29T23:20:40",
   "from": "Aufwachen",
   "from_id": 9683270591,
   "photo": "photos/photo_99@29-11-2016_23-20-40.jpg",
   "width": 477,
   "height": 395,
   "text": ""
  },
  {
   "id": 107,
   "type": "message",
   "date": "2016-11-29T23:22:17",
   "from": "Aufwachen",
   "from_id": 9683270591,
   "photo": "photos/photo_100@29-11-2016_23-22-17.jpg",
   "width": 712,
   "height": 960,
   "text": ""
  },
  {
   "id": 108,
   "type": "message",
   "date": "2016-11-29T23:30:36",
   "from": "Aufwachen",
   "from_id": 9683270591,
   "photo": "photos/photo_101@29-11-2016_23-30-36.jpg",
   "width": 686,
   "height": 960,
   "text": ""
  },
  {
   "id": 109,
   "type": "message",
   "date": "2016-11-30T06:48:48",
   "from": "Aufwachen",
   "from_id": 9683270591,
   "photo": "photos/photo_102@30-11-2016_06-48-48.jpg",
   "width": 623,
   "height": 623,
   "text": ""
  },
  {
   "id": 110,
   "type": "message",
   "date": "2016-11-30T06:50:19",
   "from": "Aufwachen",
   "from_id": 9683270591,
   "photo": "photos/photo_103@30-11-2016_06-50-19.jpg",
   "width": 720,
   "height": 720,
   "text": ""
  },
  {
   "id": 111,
   "type": "message",
   "date": "2016-11-30T10:29:46",
   "from": "Aufwachen",
   "from_id": 9683270591,
   "photo": "photos/photo_104@30-11-2016_10-29-46.jpg",
   "width": 800,
   "height": 800,
   "text": ""
  },
  {
   "id": 112,
   "type": "message",
   "date": "2016-11-30T12:51:04",
   "from": "Aufwachen",
   "from_id": 9683270591,
   "photo": "photos/photo_105@30-11-2016_12-51-04.jpg",
   "width": 656,
   "height": 623,
   "text": ""
  },
  {
   "id": 113,
   "type": "message",
   "date": "2016-11-30T13:44:13",
   "from": "Aufwachen",
   "from_id": 9683270591,
   "photo": "photos/photo_106@30-11-2016_13-44-13.jpg",
   "width": 1004,
   "height": 667,
   "text": ""
  },
  {
   "id": 114,
   "type": "message",
   "date": "2016-11-30T15:19:28",
   "from": "Aufwachen",
   "from_id": 9683270591,
   "photo": "photos/photo_107@30-11-2016_15-19-28.jpg",
   "width": 752,
   "height": 614,
   "text": ""
  },
  {
   "id": 115,
   "type": "message",
   "date": "2016-11-30T18:57:29",
   "from": "Aufwachen",
   "from_id": 9683270591,
   "photo": "photos/photo_108@30-11-2016_18-57-29.jpg",
   "width": 720,
   "height": 564,
   "text": ""
  },
  {
   "id": 116,
   "type": "message",
   "date": "2016-11-30T19:33:09",
   "from": "Aufwachen",
   "from_id": 9683270591,
   "photo": "photos/photo_109@30-11-2016_19-33-09.jpg",
   "width": 480,
   "height": 713,
   "text": ""
  },
  {
   "id": 117,
   "type": "message",
   "date": "2016-11-30T21:32:40",
   "from": "Aufwachen",
   "from_id": 9683270591,
   "photo": "photos/photo_110@30-11-2016_21-32-40.jpg",
   "width": 720,
   "height": 720,
   "text": ""
  },
  {
   "id": 118,
   "type": "message",
   "date": "2016-11-30T21:36:16",
   "from": "Aufwachen",
   "from_id": 9683270591,
   "photo": "photos/photo_111@30-11-2016_21-36-16.jpg",
   "width": 622,
   "height": 795,
   "text": ""
  },
  {
   "id": 119,
   "type": "message",
   "date": "2016-11-30T21:37:02",
   "from": "Aufwachen",
   "from_id": 9683270591,
   "photo": "photos/photo_112@30-11-2016_21-37-02.jpg",
   "width": 479,
   "height": 479,
   "text": ""
  },
  {
   "id": 120,
   "type": "message",
   "date": "2016-11-30T21:41:00",
   "from": "Aufwachen",
   "from_id": 9683270591,
   "photo": "photos/photo_113@30-11-2016_21-41-00.jpg",
   "width": 480,
   "height": 480,
   "text": ""
  },
  {
   "id": 121,
   "type": "message",
   "date": "2016-12-01T06:52:37",
   "from": "Aufwachen",
   "from_id": 9683270591,
   "photo": "photos/photo_114@01-12-2016_06-52-37.jpg",
   "width": 720,
   "height": 968,
   "text": ""
  },
  {
   "id": 122,
   "type": "message",
   "date": "2016-12-01T09:46:19",
   "from": "Aufwachen",
   "from_id": 9683270591,
   "photo": "photos/photo_115@01-12-2016_09-46-19.jpg",
   "width": 960,
   "height": 585,
   "text": ""
  },
  {
   "id": 123,
   "type": "message",
   "date": "2016-12-01T10:47:05",
   "from": "Aufwachen",
   "from_id": 9683270591,
   "photo": "photos/photo_116@01-12-2016_10-47-05.jpg",
   "width": 472,
   "height": 385,
   "text": ""
  },
  {
   "id": 124,
   "type": "message",
   "date": "2016-12-01T15:15:59",
   "from": "Aufwachen",
   "from_id": 9683270591,
   "photo": "photos/photo_117@01-12-2016_15-15-59.jpg",
   "width": 418,
   "height": 640,
   "text": ""
  },
  {
   "id": 125,
   "type": "message",
   "date": "2016-12-01T15:17:25",
   "from": "Aufwachen",
   "from_id": 9683270591,
   "photo": "photos/photo_118@01-12-2016_15-17-25.jpg",
   "width": 720,
   "height": 703,
   "text": ""
  },
  {
   "id": 126,
   "type": "message",
   "date": "2016-12-01T15:31:05",
   "from": "Aufwachen",
   "from_id": 9683270591,
   "photo": "photos/photo_119@01-12-2016_15-31-05.jpg",
   "width": 1041,
   "height": 695,
   "text": ""
  },
  {
   "id": 127,
   "type": "message",
   "date": "2016-12-01T15:31:11",
   "from": "Aufwachen",
   "from_id": 9683270591,
   "photo": "photos/photo_120@01-12-2016_15-31-11.jpg",
   "width": 900,
   "height": 900,
   "text": ""
  },
  {
   "id": 128,
   "type": "message",
   "date": "2016-12-01T18:34:19",
   "from": "Aufwachen",
   "from_id": 9683270591,
   "photo": "photos/photo_121@01-12-2016_18-34-19.jpg",
   "width": 720,
   "height": 720,
   "text": ""
  },
  {
   "id": 129,
   "type": "message",
   "date": "2016-12-01T19:09:27",
   "from": "Aufwachen",
   "from_id": 9683270591,
   "photo": "photos/photo_122@01-12-2016_19-09-27.jpg",
   "width": 370,
   "height": 530,
   "text": ""
  },
  {
   "id": 130,
   "type": "message",
   "date": "2016-12-01T19:16:41",
   "from": "Aufwachen",
   "from_id": 9683270591,
   "photo": "photos/photo_123@01-12-2016_19-16-41.jpg",
   "width": 720,
   "height": 405,
   "text": ""
  },
  {
   "id": 131,
   "type": "message",
   "date": "2016-12-01T21:25:05",
   "from": "Aufwachen",
   "from_id": 9683270591,
   "photo": "photos/photo_124@01-12-2016_21-25-05.jpg",
   "width": 650,
   "height": 650,
   "text": ""
  },
  {
   "id": 132,
   "type": "message",
   "date": "2016-12-01T21:34:06",
   "from": "Aufwachen",
   "from_id": 9683270591,
   "photo": "photos/photo_125@01-12-2016_21-34-06.jpg",
   "width": 480,
   "height": 553,
   "text": ""
  },
  {
   "id": 133,
   "type": "message",
   "date": "2016-12-01T22:34:10",
   "from": "Aufwachen",
   "from_id": 9683270591,
   "text": [
    {
     "type": "link",
     "text": "https://youtu.be/aoIOXSH114Q"
    }
   ]
  },
  {
   "id": 134,
   "type": "message",
   "date": "2016-12-02T10:46:46",
   "from": "Aufwachen",
   "from_id": 9683270591,
   "photo": "photos/photo_126@02-12-2016_10-46-46.jpg",
   "width": 360,
   "height": 184,
   "text": ""
  },
  {
   "id": 135,
   "type": "message",
   "date": "2016-12-02T12:08:54",
   "from": "Aufwachen",
   "from_id": 9683270591,
   "photo": "photos/photo_127@02-12-2016_12-08-54.jpg",
   "width": 760,
   "height": 760,
   "text": ""
  },
  {
   "id": 136,
   "type": "message",
   "date": "2016-12-02T14:12:54",
   "from": "Aufwachen",
   "from_id": 9683270591,
   "photo": "photos/photo_128@02-12-2016_14-12-54.jpg",
   "width": 720,
   "height": 720,
   "text": ""
  },
  {
   "id": 137,
   "type": "message",
   "date": "2016-12-02T15:59:26",
   "from": "Aufwachen",
   "from_id": 9683270591,
   "photo": "photos/photo_129@02-12-2016_15-59-26.jpg",
   "width": 480,
   "height": 474,
   "text": ""
  },
  {
   "id": 138,
   "type": "message",
   "date": "2016-12-02T16:31:22",
   "from": "Aufwachen",
   "from_id": 9683270591,
   "photo": "photos/photo_130@02-12-2016_16-31-22.jpg",
   "width": 554,
   "height": 767,
   "text": ""
  },
  {
   "id": 139,
   "type": "message",
   "date": "2016-12-02T16:34:23",
   "from": "Aufwachen",
   "from_id": 9683270591,
   "photo": "photos/photo_131@02-12-2016_16-34-23.jpg",
   "width": 720,
   "height": 720,
   "text": ""
  },
  {
   "id": 140,
   "type": "message",
   "date": "2016-12-02T16:36:20",
   "from": "Aufwachen",
   "from_id": 9683270591,
   "photo": "photos/photo_132@02-12-2016_16-36-20.jpg",
   "width": 480,
   "height": 698,
   "text": ""
  },
  {
   "id": 141,
   "type": "message",
   "date": "2016-12-02T16:38:17",
   "from": "Aufwachen",
   "from_id": 9683270591,
   "photo": "photos/photo_133@02-12-2016_16-38-17.jpg",
   "width": 720,
   "height": 570,
   "text": ""
  },
  {
   "id": 142,
   "type": "message",
   "date": "2016-12-02T16:56:06",
   "from": "Aufwachen",
   "from_id": 9683270591,
   "photo": "photos/photo_134@02-12-2016_16-56-06.jpg",
   "width": 552,
   "height": 828,
   "text": ""
  },
  {
   "id": 143,
   "type": "message",
   "date": "2016-12-02T16:59:19",
   "from": "Aufwachen",
   "from_id": 9683270591,
   "photo": "photos/photo_135@02-12-2016_16-59-19.jpg",
   "width": 720,
   "height": 720,
   "text": ""
  },
  {
   "id": 144,
   "type": "message",
   "date": "2016-12-02T18:19:17",
   "from": "Aufwachen",
   "from_id": 9683270591,
   "photo": "photos/photo_136@02-12-2016_18-19-17.jpg",
   "width": 600,
   "height": 462,
   "text": ""
  },
  {
   "id": 145,
   "type": "message",
   "date": "2016-12-02T18:51:09",
   "from": "Aufwachen",
   "from_id": 9683270591,
   "photo": "photos/photo_137@02-12-2016_18-51-09.jpg",
   "width": 475,
   "height": 775,
   "text": ""
  },
  {
   "id": 146,
   "type": "message",
   "date": "2016-12-02T18:51:32",
   "from": "Aufwachen",
   "from_id": 9683270591,
   "photo": "photos/photo_138@02-12-2016_18-51-32.jpg",
   "width": 585,
   "height": 312,
   "text": ""
  },
  {
   "id": 147,
   "type": "message",
   "date": "2016-12-02T19:56:29",
   "from": "Aufwachen",
   "from_id": 9683270591,
   "forwarded_from": null,
   "photo": "photos/photo_139@02-12-2016_19-56-29.jpg",
   "width": 1024,
   "height": 538,
   "text": ""
  },
  {
   "id": 148,
   "type": "message",
   "date": "2016-12-02T22:17:45",
   "from": "Aufwachen",
   "from_id": 9683270591,
   "photo": "photos/photo_140@02-12-2016_22-17-45.jpg",
   "width": 606,
   "height": 566,
   "text": ""
  },
  {
   "id": 149,
   "type": "message",
   "date": "2016-12-02T22:20:33",
   "from": "Aufwachen",
   "from_id": 9683270591,
   "photo": "photos/photo_141@02-12-2016_22-20-33.jpg",
   "width": 720,
   "height": 574,
   "text": ""
  },
  {
   "id": 150,
   "type": "message",
   "date": "2016-12-02T22:21:24",
   "from": "Aufwachen",
   "from_id": 9683270591,
   "photo": "photos/photo_142@02-12-2016_22-21-24.jpg",
   "width": 720,
   "height": 720,
   "text": ""
  },
  {
   "id": 151,
   "type": "message",
   "date": "2016-12-02T22:21:47",
   "from": "Aufwachen",
   "from_id": 9683270591,
   "photo": "photos/photo_143@02-12-2016_22-21-47.jpg",
   "width": 720,
   "height": 720,
   "text": ""
  },
  {
   "id": 152,
   "type": "message",
   "date": "2016-12-02T22:25:34",
   "from": "Aufwachen",
   "from_id": 9683270591,
   "photo": "photos/photo_144@02-12-2016_22-25-34.jpg",
   "width": 720,
   "height": 720,
   "text": ""
  },
  {
   "id": 153,
   "type": "message",
   "date": "2016-12-03T10:41:53",
   "from": "Aufwachen",
   "from_id": 9683270591,
   "photo": "photos/photo_145@03-12-2016_10-41-53.jpg",
   "width": 720,
   "height": 890,
   "text": ""
  },
  {
   "id": 154,
   "type": "message",
   "date": "2016-12-03T11:59:27",
   "from": "Aufwachen",
   "from_id": 9683270591,
   "photo": "photos/photo_146@03-12-2016_11-59-27.jpg",
   "width": 387,
   "height": 395,
   "text": ""
  },
  {
   "id": 155,
   "type": "message",
   "date": "2016-12-03T13:36:52",
   "from": "Aufwachen",
   "from_id": 9683270591,
   "photo": "photos/photo_147@03-12-2016_13-36-52.jpg",
   "width": 711,
   "height": 711,
   "text": ""
  },
  {
   "id": 156,
   "type": "message",
   "date": "2016-12-03T13:37:36",
   "from": "Aufwachen",
   "from_id": 9683270591,
   "photo": "photos/photo_148@03-12-2016_13-37-36.jpg",
   "width": 520,
   "height": 510,
   "text": ""
  },
  {
   "id": 157,
   "type": "message",
   "date": "2016-12-03T16:29:51",
   "from": "Aufwachen",
   "from_id": 9683270591,
   "photo": "photos/photo_149@03-12-2016_16-29-51.jpg",
   "width": 642,
   "height": 626,
   "text": ""
  },
  {
   "id": 158,
   "type": "message",
   "date": "2016-12-03T18:09:16",
   "from": "Aufwachen",
   "from_id": 9683270591,
   "photo": "photos/photo_150@03-12-2016_18-09-16.jpg",
   "width": 317,
   "height": 395,
   "text": ""
  },
  {
   "id": 159,
   "type": "message",
   "date": "2016-12-03T19:48:41",
   "from": "Aufwachen",
   "from_id": 9683270591,
   "photo": "photos/photo_151@03-12-2016_19-48-41.jpg",
   "width": 720,
   "height": 720,
   "text": ""
  },
  {
   "id": 160,
   "type": "message",
   "date": "2016-12-03T19:55:05",
   "from": "Aufwachen",
   "from_id": 9683270591,
   "photo": "photos/photo_152@03-12-2016_19-55-05.jpg",
   "width": 600,
   "height": 600,
   "text": ""
  },
  {
   "id": 161,
   "type": "message",
   "date": "2016-12-03T19:55:23",
   "from": "Aufwachen",
   "from_id": 9683270591,
   "photo": "photos/photo_153@03-12-2016_19-55-23.jpg",
   "width": 712,
   "height": 960,
   "text": ""
  },
  {
   "id": 162,
   "type": "message",
   "date": "2016-12-03T21:12:39",
   "from": "Aufwachen",
   "from_id": 9683270591,
   "photo": "photos/photo_154@03-12-2016_21-12-39.jpg",
   "width": 700,
   "height": 700,
   "text": ""
  },
  {
   "id": 163,
   "type": "message",
   "date": "2016-12-03T21:24:26",
   "from": "Aufwachen",
   "from_id": 9683270591,
   "photo": "photos/photo_155@03-12-2016_21-24-26.jpg",
   "width": 720,
   "height": 563,
   "text": ""
  },
  {
   "id": 164,
   "type": "message",
   "date": "2016-12-04T08:56:23",
   "from": "Aufwachen",
   "from_id": 9683270591,
   "photo": "photos/photo_156@04-12-2016_08-56-23.jpg",
   "width": 552,
   "height": 842,
   "text": ""
  },
  {
   "id": 165,
   "type": "message",
   "date": "2016-12-04T09:28:11",
   "from": "Aufwachen",
   "from_id": 9683270591,
   "photo": "photos/photo_157@04-12-2016_09-28-11.jpg",
   "width": 720,
   "height": 720,
   "text": ""
  },
  {
   "id": 166,
   "type": "message",
   "date": "2016-12-04T09:29:44",
   "from": "Aufwachen",
   "from_id": 9683270591,
   "photo": "photos/photo_158@04-12-2016_09-29-44.jpg",
   "width": 720,
   "height": 447,
   "text": ""
  },
  {
   "id": 167,
   "type": "message",
   "date": "2016-12-04T09:30:49",
   "from": "Aufwachen",
   "from_id": 9683270591,
   "photo": "photos/photo_159@04-12-2016_09-30-49.jpg",
   "width": 448,
   "height": 448,
   "text": ""
  },
  {
   "id": 168,
   "type": "message",
   "date": "2016-12-04T09:32:13",
   "from": "Aufwachen",
   "from_id": 9683270591,
   "photo": "photos/photo_160@04-12-2016_09-32-13.jpg",
   "width": 720,
   "height": 452,
   "text": ""
  },
  {
   "id": 169,
   "type": "message",
   "date": "2016-12-04T09:33:20",
   "from": "Aufwachen",
   "from_id": 9683270591,
   "photo": "photos/photo_161@04-12-2016_09-33-20.jpg",
   "width": 480,
   "height": 270,
   "text": ""
  },
  {
   "id": 170,
   "type": "message",
   "date": "2016-12-04T09:37:19",
   "from": "Aufwachen",
   "from_id": 9683270591,
   "photo": "photos/photo_162@04-12-2016_09-37-19.jpg",
   "width": 1280,
   "height": 1098,
   "text": ""
  },
  {
   "id": 171,
   "type": "message",
   "date": "2016-12-04T09:37:29",
   "from": "Aufwachen",
   "from_id": 9683270591,
   "photo": "photos/photo_163@04-12-2016_09-37-29.jpg",
   "width": 409,
   "height": 410,
   "text": ""
  },
  {
   "id": 172,
   "type": "message",
   "date": "2016-12-04T10:59:03",
   "from": "Aufwachen",
   "from_id": 9683270591,
   "photo": "photos/photo_164@04-12-2016_10-59-03.jpg",
   "width": 720,
   "height": 576,
   "text": ""
  },
  {
   "id": 173,
   "type": "message",
   "date": "2016-12-04T11:01:54",
   "from": "Aufwachen",
   "from_id": 9683270591,
   "photo": "photos/photo_165@04-12-2016_11-01-54.jpg",
   "width": 720,
   "height": 507,
   "text": ""
  },
  {
   "id": 174,
   "type": "message",
   "date": "2016-12-04T11:05:10",
   "from": "Aufwachen",
   "from_id": 9683270591,
   "photo": "photos/photo_166@04-12-2016_11-05-10.jpg",
   "width": 605,
   "height": 605,
   "text": ""
  },
  {
   "id": 175,
   "type": "message",
   "date": "2016-12-04T12:07:17",
   "from": "Aufwachen",
   "from_id": 9683270591,
   "photo": "photos/photo_167@04-12-2016_12-07-17.jpg",
   "width": 562,
   "height": 800,
   "text": ""
  },
  {
   "id": 176,
   "type": "message",
   "date": "2016-12-04T12:09:52",
   "from": "Aufwachen",
   "from_id": 9683270591,
   "photo": "photos/photo_168@04-12-2016_12-09-52.jpg",
   "width": 720,
   "height": 496,
   "text": ""
  },
  {
   "id": 177,
   "type": "message",
   "date": "2016-12-04T12:11:37",
   "from": "Aufwachen",
   "from_id": 9683270591,
   "photo": "photos/photo_169@04-12-2016_12-11-37.jpg",
   "width": 720,
   "height": 562,
   "text": ""
  },
  {
   "id": 178,
   "type": "message",
   "date": "2016-12-04T13:30:29",
   "from": "Aufwachen",
   "from_id": 9683270591,
   "photo": "photos/photo_170@04-12-2016_13-30-29.jpg",
   "width": 720,
   "height": 686,
   "text": ""
  },
  {
   "id": 179,
   "type": "message",
   "date": "2016-12-04T14:43:20",
   "from": "Aufwachen",
   "from_id": 9683270591,
   "photo": "photos/photo_171@04-12-2016_14-43-20.jpg",
   "width": 480,
   "height": 489,
   "text": ""
  },
  {
   "id": 180,
   "type": "message",
   "date": "2016-12-04T15:41:50",
   "from": "Aufwachen",
   "from_id": 9683270591,
   "photo": "photos/photo_172@04-12-2016_15-41-50.jpg",
   "width": 480,
   "height": 354,
   "text": ""
  },
  {
   "id": 181,
   "type": "message",
   "date": "2016-12-04T15:42:33",
   "from": "Aufwachen",
   "from_id": 9683270591,
   "photo": "photos/photo_173@04-12-2016_15-42-33.jpg",
   "width": 555,
   "height": 707,
   "text": ""
  },
  {
   "id": 182,
   "type": "message",
   "date": "2016-12-04T16:50:50",
   "from": "Aufwachen",
   "from_id": 9683270591,
   "photo": "photos/photo_174@04-12-2016_16-50-50.jpg",
   "width": 616,
   "height": 545,
   "text": ""
  },
  {
   "id": 183,
   "type": "message",
   "date": "2016-12-04T17:17:03",
   "from": "Aufwachen",
   "from_id": 9683270591,
   "photo": "photos/photo_175@04-12-2016_17-17-03.jpg",
   "width": 576,
   "height": 624,
   "text": ""
  },
  {
   "id": 184,
   "type": "message",
   "date": "2016-12-04T17:22:02",
   "from": "Aufwachen",
   "from_id": 9683270591,
   "photo": "photos/photo_176@04-12-2016_17-22-02.jpg",
   "width": 705,
   "height": 705,
   "text": ""
  },
  {
   "id": 185,
   "type": "message",
   "date": "2016-12-04T17:55:33",
   "from": "Aufwachen",
   "from_id": 9683270591,
   "photo": "photos/photo_177@04-12-2016_17-55-33.jpg",
   "width": 720,
   "height": 265,
   "text": ""
  },
  {
   "id": 186,
   "type": "message",
   "date": "2016-12-04T18:01:22",
   "from": "Aufwachen",
   "from_id": 9683270591,
   "photo": "photos/photo_178@04-12-2016_18-01-22.jpg",
   "width": 960,
   "height": 960,
   "text": ""
  },
  {
   "id": 187,
   "type": "message",
   "date": "2016-12-04T19:00:22",
   "from": "Aufwachen",
   "from_id": 9683270591,
   "photo": "photos/photo_179@04-12-2016_19-00-22.jpg",
   "width": 953,
   "height": 753,
   "text": ""
  },
  {
   "id": 188,
   "type": "message",
   "date": "2016-12-04T19:00:27",
   "from": "Aufwachen",
   "from_id": 9683270591,
   "photo": "photos/photo_180@04-12-2016_19-00-27.jpg",
   "width": 650,
   "height": 250,
   "text": ""
  },
  {
   "id": 189,
   "type": "message",
   "date": "2016-12-04T19:46:57",
   "from": "Aufwachen",
   "from_id": 9683270591,
   "photo": "photos/photo_181@04-12-2016_19-46-57.jpg",
   "width": 720,
   "height": 453,
   "text": ""
  },
  {
   "id": 190,
   "type": "message",
   "date": "2016-12-04T19:54:20",
   "from": "Aufwachen",
   "from_id": 9683270591,
   "photo": "photos/photo_182@04-12-2016_19-54-20.jpg",
   "width": 206,
   "height": 250,
   "text": ""
  },
  {
   "id": 191,
   "type": "message",
   "date": "2016-12-04T19:56:15",
   "from": "Aufwachen",
   "from_id": 9683270591,
   "photo": "photos/photo_183@04-12-2016_19-56-15.jpg",
   "width": 720,
   "height": 720,
   "text": ""
  },
  {
   "id": 192,
   "type": "message",
   "date": "2016-12-04T20:14:38",
   "from": "Aufwachen",
   "from_id": 9683270591,
   "photo": "photos/photo_184@04-12-2016_20-14-38.jpg",
   "width": 720,
   "height": 509,
   "text": ""
  },
  {
   "id": 193,
   "type": "message",
   "date": "2016-12-04T21:17:24",
   "from": "Aufwachen",
   "from_id": 9683270591,
   "photo": "photos/photo_185@04-12-2016_21-17-24.jpg",
   "width": 746,
   "height": 618,
   "text": ""
  },
  {
   "id": 194,
   "type": "message",
   "date": "2016-12-04T21:43:59",
   "from": "Aufwachen",
   "from_id": 9683270591,
   "photo": "photos/photo_186@04-12-2016_21-43-59.jpg",
   "width": 720,
   "height": 540,
   "text": ""
  },
  {
   "id": 196,
   "type": "message",
   "date": "2016-12-04T21:56:56",
   "from": "Aufwachen",
   "from_id": 9683270591,
   "file": "video_files/video_3@04-12-2016_21-56-56.mp4",
   "thumbnail": "video_files/video_3@04-12-2016_21-56-56.mp4_thumb.jpg",
   "media_type": "video_file",
   "mime_type": "video/mp4",
   "duration_seconds": 120,
   "width": 640,
   "height": 360,
   "text": ""
  },
  {
   "id": 197,
   "type": "message",
   "date": "2016-12-05T09:32:26",
   "from": "Aufwachen",
   "from_id": 9683270591,
   "photo": "photos/photo_187@05-12-2016_09-32-26.jpg",
   "width": 1100,
   "height": 1040,
   "text": ""
  },
  {
   "id": 198,
   "type": "message",
   "date": "2016-12-05T14:01:45",
   "from": "Aufwachen",
   "from_id": 9683270591,
   "photo": "photos/photo_188@05-12-2016_14-01-45.jpg",
   "width": 564,
   "height": 564,
   "text": ""
  },
  {
   "id": 199,
   "type": "message",
   "date": "2016-12-05T14:01:50",
   "from": "Aufwachen",
   "from_id": 9683270591,
   "photo": "photos/photo_189@05-12-2016_14-01-50.jpg",
   "width": 960,
   "height": 640,
   "text": ""
  },
  {
   "id": 200,
   "type": "message",
   "date": "2016-12-05T18:20:23",
   "from": "Aufwachen",
   "from_id": 9683270591,
   "photo": "photos/photo_190@05-12-2016_18-20-23.jpg",
   "width": 720,
   "height": 720,
   "text": ""
  },
  {
   "id": 201,
   "type": "message",
   "date": "2016-12-05T18:23:39",
   "from": "Aufwachen",
   "from_id": 9683270591,
   "photo": "photos/photo_191@05-12-2016_18-23-39.jpg",
   "width": 623,
   "height": 623,
   "text": ""
  },
  {
   "id": 202,
   "type": "message",
   "date": "2016-12-05T18:24:46",
   "from": "Aufwachen",
   "from_id": 9683270591,
   "photo": "photos/photo_192@05-12-2016_18-24-46.jpg",
   "width": 720,
   "height": 761,
   "text": ""
  },
  {
   "id": 203,
   "type": "message",
   "date": "2016-12-05T21:19:35",
   "from": "Aufwachen",
   "from_id": 9683270591,
   "photo": "photos/photo_193@05-12-2016_21-19-35.jpg",
   "width": 640,
   "height": 480,
   "text": ""
  },
  {
   "id": 204,
   "type": "message",
   "date": "2016-12-05T21:22:58",
   "from": "Aufwachen",
   "from_id": 9683270591,
   "photo": "photos/photo_194@05-12-2016_21-22-58.jpg",
   "width": 656,
   "height": 656,
   "text": ""
  },
  {
   "id": 205,
   "type": "message",
   "date": "2016-12-05T21:23:55",
   "from": "Aufwachen",
   "from_id": 9683270591,
   "photo": "photos/photo_195@05-12-2016_21-23-55.jpg",
   "width": 720,
   "height": 720,
   "text": ""
  },
  {
   "id": 206,
   "type": "message",
   "date": "2016-12-05T21:25:02",
   "from": "Aufwachen",
   "from_id": 9683270591,
   "photo": "photos/photo_196@05-12-2016_21-25-02.jpg",
   "width": 604,
   "height": 382,
   "text": ""
  },
  {
   "id": 207,
   "type": "message",
   "date": "2016-12-05T21:25:39",
   "from": "Aufwachen",
   "from_id": 9683270591,
   "photo": "photos/photo_197@05-12-2016_21-25-39.jpg",
   "width": 720,
   "height": 672,
   "text": ""
  },
  {
   "id": 208,
   "type": "message",
   "date": "2016-12-05T21:26:41",
   "from": "Aufwachen",
   "from_id": 9683270591,
   "photo": "photos/photo_198@05-12-2016_21-26-41.jpg",
   "width": 720,
   "height": 709,
   "text": ""
  },
  {
   "id": 209,
   "type": "message",
   "date": "2016-12-05T21:28:19",
   "from": "Aufwachen",
   "from_id": 9683270591,
   "photo": "photos/photo_199@05-12-2016_21-28-19.jpg",
   "width": 720,
   "height": 360,
   "text": ""
  },
  {
   "id": 210,
   "type": "message",
   "date": "2016-12-06T09:34:28",
   "from": "Aufwachen",
   "from_id": 9683270591,
   "photo": "photos/photo_200@06-12-2016_09-34-28.jpg",
   "width": 477,
   "height": 535,
   "text": ""
  },
  {
   "id": 211,
   "type": "message",
   "date": "2016-12-06T09:34:39",
   "from": "Aufwachen",
   "from_id": 9683270591,
   "photo": "photos/photo_201@06-12-2016_09-34-39.jpg",
   "width": 1080,
   "height": 1080,
   "text": ""
  },
  {
   "id": 212,
   "type": "message",
   "date": "2016-12-06T09:52:56",
   "from": "Aufwachen",
   "from_id": 9683270591,
   "photo": "photos/photo_202@06-12-2016_09-52-56.jpg",
   "width": 345,
   "height": 550,
   "text": ""
  },
  {
   "id": 213,
   "type": "message",
   "date": "2016-12-06T09:53:07",
   "from": "Aufwachen",
   "from_id": 9683270591,
   "photo": "photos/photo_203@06-12-2016_09-53-07.jpg",
   "width": 480,
   "height": 480,
   "text": ""
  },
  {
   "id": 214,
   "type": "message",
   "date": "2016-12-06T23:26:04",
   "from": "Aufwachen",
   "from_id": 9683270591,
   "photo": "photos/photo_204@06-12-2016_23-26-04.jpg",
   "width": 550,
   "height": 550,
   "text": ""
  },
  {
   "id": 215,
   "type": "message",
   "date": "2016-12-06T23:27:10",
   "from": "Aufwachen",
   "from_id": 9683270591,
   "photo": "photos/photo_205@06-12-2016_23-27-10.jpg",
   "width": 720,
   "height": 720,
   "text": ""
  },
  {
   "id": 216,
   "type": "message",
   "date": "2016-12-06T23:28:19",
   "from": "Aufwachen",
   "from_id": 9683270591,
   "photo": "photos/photo_206@06-12-2016_23-28-19.jpg",
   "width": 720,
   "height": 838,
   "text": ""
  },
  {
   "id": 217,
   "type": "message",
   "date": "2016-12-06T23:28:51",
   "from": "Aufwachen",
   "from_id": 9683270591,
   "photo": "photos/photo_207@06-12-2016_23-28-51.jpg",
   "width": 720,
   "height": 720,
   "text": ""
  },
  {
   "id": 218,
   "type": "message",
   "date": "2016-12-06T23:29:14",
   "from": "Aufwachen",
   "from_id": 9683270591,
   "photo": "photos/photo_208@06-12-2016_23-29-14.jpg",
   "width": 705,
   "height": 705,
   "text": ""
  },
  {
   "id": 219,
   "type": "message",
   "date": "2016-12-06T23:30:17",
   "from": "Aufwachen",
   "from_id": 9683270591,
   "photo": "photos/photo_209@06-12-2016_23-30-17.jpg",
   "width": 720,
   "height": 720,
   "text": ""
  },
  {
   "id": 220,
   "type": "message",
   "date": "2016-12-06T23:30:43",
   "from": "Aufwachen",
   "from_id": 9683270591,
   "photo": "photos/photo_210@06-12-2016_23-30-43.jpg",
   "width": 720,
   "height": 480,
   "text": ""
  },
  {
   "id": 221,
   "type": "message",
   "date": "2016-12-06T23:31:03",
   "from": "Aufwachen",
   "from_id": 9683270591,
   "photo": "photos/photo_211@06-12-2016_23-31-03.jpg",
   "width": 480,
   "height": 339,
   "text": ""
  },
  {
   "id": 222,
   "type": "message",
   "date": "2016-12-06T23:35:28",
   "from": "Aufwachen",
   "from_id": 9683270591,
   "photo": "photos/photo_212@06-12-2016_23-35-28.jpg",
   "width": 640,
   "height": 960,
   "text": ""
  },
  {
   "id": 223,
   "type": "message",
   "date": "2016-12-06T23:35:50",
   "from": "Aufwachen",
   "from_id": 9683270591,
   "photo": "photos/photo_213@06-12-2016_23-35-50.jpg",
   "width": 400,
   "height": 390,
   "text": ""
  },
  {
   "id": 224,
   "type": "message",
   "date": "2016-12-06T23:36:11",
   "from": "Aufwachen",
   "from_id": 9683270591,
   "photo": "photos/photo_214@06-12-2016_23-36-11.jpg",
   "width": 720,
   "height": 541,
   "text": ""
  },
  {
   "id": 225,
   "type": "message",
   "date": "2016-12-06T23:36:46",
   "from": "Aufwachen",
   "from_id": 9683270591,
   "photo": "photos/photo_215@06-12-2016_23-36-46.jpg",
   "width": 720,
   "height": 936,
   "text": ""
  },
  {
   "id": 226,
   "type": "message",
   "date": "2016-12-06T23:39:32",
   "from": "Aufwachen",
   "from_id": 9683270591,
   "photo": "photos/photo_216@06-12-2016_23-39-32.jpg",
   "width": 688,
   "height": 767,
   "text": ""
  },
  {
   "id": 227,
   "type": "message",
   "date": "2016-12-07T14:33:28",
   "from": "Aufwachen",
   "from_id": 9683270591,
   "photo": "photos/photo_217@07-12-2016_14-33-28.jpg",
   "width": 591,
   "height": 428,
   "text": ""
  },
  {
   "id": 228,
   "type": "message",
   "date": "2016-12-07T14:33:37",
   "from": "Aufwachen",
   "from_id": 9683270591,
   "photo": "photos/photo_218@07-12-2016_14-33-37.jpg",
   "width": 666,
   "height": 444,
   "text": ""
  },
  {
   "id": 229,
   "type": "message",
   "date": "2016-12-07T14:33:44",
   "from": "Aufwachen",
   "from_id": 9683270591,
   "photo": "photos/photo_219@07-12-2016_14-33-44.jpg",
   "width": 500,
   "height": 500,
   "text": ""
  },
  {
   "id": 230,
   "type": "message",
   "date": "2016-12-07T18:31:03",
   "from": "Aufwachen",
   "from_id": 9683270591,
   "photo": "photos/photo_220@07-12-2016_18-31-03.jpg",
   "width": 720,
   "height": 463,
   "text": ""
  },
  {
   "id": 231,
   "type": "message",
   "date": "2016-12-07T18:33:34",
   "from": "Aufwachen",
   "from_id": 9683270591,
   "photo": "photos/photo_221@07-12-2016_18-33-34.jpg",
   "width": 720,
   "height": 467,
   "text": ""
  },
  {
   "id": 232,
   "type": "message",
   "date": "2016-12-07T18:34:19",
   "from": "Aufwachen",
   "from_id": 9683270591,
   "photo": "photos/photo_222@07-12-2016_18-34-19.jpg",
   "width": 720,
   "height": 720,
   "text": ""
  },
  {
   "id": 233,
   "type": "message",
   "date": "2016-12-07T19:18:36",
   "from": "Aufwachen",
   "from_id": 9683270591,
   "photo": "photos/photo_223@07-12-2016_19-18-36.jpg",
   "width": 720,
   "height": 720,
   "text": ""
  },
  {
   "id": 234,
   "type": "message",
   "date": "2016-12-07T19:20:33",
   "from": "Aufwachen",
   "from_id": 9683270591,
   "photo": "photos/photo_224@07-12-2016_19-20-33.jpg",
   "width": 720,
   "height": 720,
   "text": ""
  },
  {
   "id": 235,
   "type": "message",
   "date": "2016-12-07T19:21:25",
   "from": "Aufwachen",
   "from_id": 9683270591,
   "photo": "photos/photo_225@07-12-2016_19-21-25.jpg",
   "width": 720,
   "height": 720,
   "text": ""
  },
  {
   "id": 236,
   "type": "message",
   "date": "2016-12-07T19:21:49",
   "from": "Aufwachen",
   "from_id": 9683270591,
   "photo": "photos/photo_226@07-12-2016_19-21-49.jpg",
   "width": 720,
   "height": 857,
   "text": ""
  },
  {
   "id": 237,
   "type": "message",
   "date": "2016-12-07T21:30:07",
   "from": "Aufwachen",
   "from_id": 9683270591,
   "photo": "photos/photo_227@07-12-2016_21-30-07.jpg",
   "width": 720,
   "height": 761,
   "text": ""
  },
  {
   "id": 238,
   "type": "message",
   "date": "2016-12-07T21:32:53",
   "from": "Aufwachen",
   "from_id": 9683270591,
   "photo": "photos/photo_228@07-12-2016_21-32-53.jpg",
   "width": 720,
   "height": 473,
   "text": ""
  },
  {
   "id": 239,
   "type": "message",
   "date": "2016-12-07T21:33:56",
   "from": "Aufwachen",
   "from_id": 9683270591,
   "photo": "photos/photo_229@07-12-2016_21-33-56.jpg",
   "width": 536,
   "height": 536,
   "text": ""
  },
  {
   "id": 240,
   "type": "message",
   "date": "2016-12-07T21:34:35",
   "from": "Aufwachen",
   "from_id": 9683270591,
   "photo": "photos/photo_230@07-12-2016_21-34-35.jpg",
   "width": 675,
   "height": 594,
   "text": ""
  },
  {
   "id": 241,
   "type": "message",
   "date": "2016-12-07T21:34:56",
   "from": "Aufwachen",
   "from_id": 9683270591,
   "photo": "photos/photo_231@07-12-2016_21-34-56.jpg",
   "width": 720,
   "height": 720,
   "text": ""
  },
  {
   "id": 242,
   "type": "message",
   "date": "2016-12-07T21:35:28",
   "from": "Aufwachen",
   "from_id": 9683270591,
   "photo": "photos/photo_232@07-12-2016_21-35-28.jpg",
   "width": 720,
   "height": 588,
   "text": ""
  },
  {
   "id": 243,
   "type": "message",
   "date": "2016-12-07T21:37:49",
   "from": "Aufwachen",
   "from_id": 9683270591,
   "photo": "photos/photo_233@07-12-2016_21-37-49.jpg",
   "width": 500,
   "height": 500,
   "text": ""
  },
  {
   "id": 244,
   "type": "message",
   "date": "2016-12-07T21:41:44",
   "from": "Aufwachen",
   "from_id": 9683270591,
   "photo": "photos/photo_234@07-12-2016_21-41-44.jpg",
   "width": 720,
   "height": 711,
   "text": ""
  },
  {
   "id": 245,
   "type": "message",
   "date": "2016-12-07T21:42:58",
   "from": "Aufwachen",
   "from_id": 9683270591,
   "photo": "photos/photo_235@07-12-2016_21-42-58.jpg",
   "width": 400,
   "height": 400,
   "text": ""
  },
  {
   "id": 246,
   "type": "message",
   "date": "2016-12-07T21:45:10",
   "from": "Aufwachen",
   "from_id": 9683270591,
   "photo": "photos/photo_236@07-12-2016_21-45-10.jpg",
   "width": 716,
   "height": 682,
   "text": ""
  },
  {
   "id": 247,
   "type": "message",
   "date": "2016-12-07T21:45:47",
   "from": "Aufwachen",
   "from_id": 9683270591,
   "photo": "photos/photo_237@07-12-2016_21-45-47.jpg",
   "width": 720,
   "height": 540,
   "text": ""
  },
  {
   "id": 248,
   "type": "message",
   "date": "2016-12-07T21:47:00",
   "from": "Aufwachen",
   "from_id": 9683270591,
   "photo": "photos/photo_238@07-12-2016_21-47-00.jpg",
   "width": 606,
   "height": 566,
   "text": ""
  },
  {
   "id": 249,
   "type": "message",
   "date": "2016-12-07T21:47:49",
   "from": "Aufwachen",
   "from_id": 9683270591,
   "photo": "photos/photo_239@07-12-2016_21-47-49.jpg",
   "width": 720,
   "height": 720,
   "text": ""
  },
  {
   "id": 250,
   "type": "message",
   "date": "2016-12-08T06:46:48",
   "from": "Aufwachen",
   "from_id": 9683270591,
   "photo": "photos/photo_240@08-12-2016_06-46-48.jpg",
   "width": 720,
   "height": 712,
   "text": ""
  },
  {
   "id": 251,
   "type": "message",
   "date": "2016-12-08T18:27:28",
   "from": "Aufwachen",
   "from_id": 9683270591,
   "photo": "photos/photo_241@08-12-2016_18-27-28.jpg",
   "width": 315,
   "height": 315,
   "text": ""
  },
  {
   "id": 252,
   "type": "message",
   "date": "2016-12-08T19:11:01",
   "from": "Aufwachen",
   "from_id": 9683270591,
   "photo": "photos/photo_242@08-12-2016_19-11-01.jpg",
   "width": 597,
   "height": 415,
   "text": ""
  },
  {
   "id": 253,
   "type": "message",
   "date": "2016-12-08T19:12:17",
   "from": "Aufwachen",
   "from_id": 9683270591,
   "photo": "photos/photo_243@08-12-2016_19-12-17.jpg",
   "width": 720,
   "height": 708,
   "text": ""
  },
  {
   "id": 254,
   "type": "message",
   "date": "2016-12-08T19:42:40",
   "from": "Aufwachen",
   "from_id": 9683270591,
   "photo": "photos/photo_244@08-12-2016_19-42-40.jpg",
   "width": 600,
   "height": 600,
   "text": ""
  },
  {
   "id": 255,
   "type": "message",
   "date": "2016-12-08T21:38:56",
   "from": "Aufwachen",
   "from_id": 9683270591,
   "photo": "photos/photo_245@08-12-2016_21-38-56.jpg",
   "width": 720,
   "height": 720,
   "text": ""
  },
  {
   "id": 256,
   "type": "message",
   "date": "2016-12-08T21:40:32",
   "from": "Aufwachen",
   "from_id": 9683270591,
   "photo": "photos/photo_246@08-12-2016_21-40-32.jpg",
   "width": 564,
   "height": 564,
   "text": ""
  },
  {
   "id": 257,
   "type": "message",
   "date": "2016-12-08T21:42:05",
   "from": "Aufwachen",
   "from_id": 9683270591,
   "photo": "photos/photo_247@08-12-2016_21-42-05.jpg",
   "width": 480,
   "height": 375,
   "text": ""
  },
  {
   "id": 258,
   "type": "message",
   "date": "2016-12-08T21:43:27",
   "from": "Aufwachen",
   "from_id": 9683270591,
   "photo": "photos/photo_248@08-12-2016_21-43-27.jpg",
   "width": 480,
   "height": 461,
   "text": ""
  },
  {
   "id": 259,
   "type": "message",
   "date": "2016-12-08T21:44:13",
   "from": "Aufwachen",
   "from_id": 9683270591,
   "photo": "photos/photo_249@08-12-2016_21-44-13.jpg",
   "width": 720,
   "height": 720,
   "text": ""
  },
  {
   "id": 260,
   "type": "message",
   "date": "2016-12-08T21:45:44",
   "from": "Aufwachen",
   "from_id": 9683270591,
   "photo": "photos/photo_250@08-12-2016_21-45-44.jpg",
   "width": 480,
   "height": 669,
   "text": ""
  },
  {
   "id": 261,
   "type": "message",
   "date": "2016-12-08T21:48:04",
   "from": "Aufwachen",
   "from_id": 9683270591,
   "photo": "photos/photo_251@08-12-2016_21-48-04.jpg",
   "width": 480,
   "height": 853,
   "text": ""
  },
  {
   "id": 262,
   "type": "message",
   "date": "2016-12-08T21:48:42",
   "from": "Aufwachen",
   "from_id": 9683270591,
   "photo": "photos/photo_252@08-12-2016_21-48-42.jpg",
   "width": 703,
   "height": 350,
   "text": ""
  },
  {
   "id": 263,
   "type": "message",
   "date": "2016-12-08T21:49:22",
   "from": "Aufwachen",
   "from_id": 9683270591,
   "photo": "photos/photo_253@08-12-2016_21-49-22.jpg",
   "width": 720,
   "height": 672,
   "text": ""
  },
  {
   "id": 264,
   "type": "message",
   "date": "2016-12-08T21:49:57",
   "from": "Aufwachen",
   "from_id": 9683270591,
   "photo": "photos/photo_254@08-12-2016_21-49-57.jpg",
   "width": 480,
   "height": 480,
   "text": ""
  },
  {
   "id": 265,
   "type": "message",
   "date": "2016-12-08T21:52:21",
   "from": "Aufwachen",
   "from_id": 9683270591,
   "photo": "photos/photo_255@08-12-2016_21-52-21.jpg",
   "width": 720,
   "height": 737,
   "text": ""
  },
  {
   "id": 266,
   "type": "message",
   "date": "2016-12-08T21:52:50",
   "from": "Aufwachen",
   "from_id": 9683270591,
   "photo": "photos/photo_256@08-12-2016_21-52-50.jpg",
   "width": 720,
   "height": 720,
   "text": ""
  },
  {
   "id": 268,
   "type": "message",
   "date": "2016-12-08T22:00:07",
   "from": "Aufwachen",
   "from_id": 9683270591,
   "photo": "photos/photo_257@08-12-2016_22-00-07.jpg",
   "width": 720,
   "height": 684,
   "text": ""
  },
  {
   "id": 269,
   "type": "message",
   "date": "2016-12-08T22:07:32",
   "from": "Aufwachen",
   "from_id": 9683270591,
   "photo": "photos/photo_258@08-12-2016_22-07-32.jpg",
   "width": 720,
   "height": 885,
   "text": ""
  },
  {
   "id": 270,
   "type": "message",
   "date": "2016-12-08T22:09:46",
   "from": "Aufwachen",
   "from_id": 9683270591,
   "photo": "photos/photo_259@08-12-2016_22-09-46.jpg",
   "width": 720,
   "height": 714,
   "text": ""
  },
  {
   "id": 271,
   "type": "message",
   "date": "2016-12-09T08:43:50",
   "from": "Aufwachen",
   "from_id": 9683270591,
   "forwarded_from": "Newsticker ( aktuelle News und Eilmeldungen )",
   "photo": "photos/photo_260@09-12-2016_08-43-50.jpg",
   "width": 1043,
   "height": 1280,
   "text": ""
  },
  {
   "id": 272,
   "type": "message",
   "date": "2016-12-09T10:39:47",
   "from": "Aufwachen",
   "from_id": 9683270591,
   "photo": "photos/photo_261@09-12-2016_10-39-47.jpg",
   "width": 1373,
   "height": 1944,
   "text": ""
  },
  {
   "id": 273,
   "type": "message",
   "date": "2016-12-09T13:43:14",
   "from": "Aufwachen",
   "from_id": 9683270591,
   "photo": "photos/photo_262@09-12-2016_13-43-14.jpg",
   "width": 601,
   "height": 601,
   "text": ""
  },
  {
   "id": 274,
   "type": "message",
   "date": "2016-12-09T17:24:55",
   "from": "Aufwachen",
   "from_id": 9683270591,
   "photo": "photos/photo_263@09-12-2016_17-24-55.jpg",
   "width": 960,
   "height": 640,
   "text": ""
  },
  {
   "id": 275,
   "type": "message",
   "date": "2016-12-09T18:06:19",
   "from": "Aufwachen",
   "from_id": 9683270591,
   "photo": "photos/photo_264@09-12-2016_18-06-19.jpg",
   "width": 720,
   "height": 720,
   "text": ""
  },
  {
   "id": 276,
   "type": "message",
   "date": "2016-12-09T18:08:57",
   "from": "Aufwachen",
   "from_id": 9683270591,
   "photo": "photos/photo_265@09-12-2016_18-08-57.jpg",
   "width": 720,
   "height": 843,
   "text": ""
  },
  {
   "id": 277,
   "type": "message",
   "date": "2016-12-09T18:10:05",
   "from": "Aufwachen",
   "from_id": 9683270591,
   "photo": "photos/photo_266@09-12-2016_18-10-05.jpg",
   "width": 662,
   "height": 436,
   "text": ""
  },
  {
   "id": 278,
   "type": "message",
   "date": "2016-12-09T21:10:57",
   "from": "Aufwachen",
   "from_id": 9683270591,
   "photo": "photos/photo_267@09-12-2016_21-10-57.jpg",
   "width": 480,
   "height": 463,
   "text": ""
  },
  {
   "id": 279,
   "type": "message",
   "date": "2016-12-09T21:12:53",
   "from": "Aufwachen",
   "from_id": 9683270591,
   "photo": "photos/photo_268@09-12-2016_21-12-53.jpg",
   "width": 720,
   "height": 476,
   "text": ""
  },
  {
   "id": 280,
   "type": "message",
   "date": "2016-12-09T21:14:11",
   "from": "Aufwachen",
   "from_id": 9683270591,
   "photo": "photos/photo_269@09-12-2016_21-14-11.jpg",
   "width": 656,
   "height": 480,
   "text": ""
  },
  {
   "id": 281,
   "type": "message",
   "date": "2016-12-09T21:16:38",
   "from": "Aufwachen",
   "from_id": 9683270591,
   "photo": "photos/photo_270@09-12-2016_21-16-38.jpg",
   "width": 425,
   "height": 597,
   "text": ""
  },
  {
   "id": 282,
   "type": "message",
   "date": "2016-12-09T21:18:11",
   "from": "Aufwachen",
   "from_id": 9683270591,
   "photo": "photos/photo_271@09-12-2016_21-18-11.jpg",
   "width": 720,
   "height": 391,
   "text": ""
  },
  {
   "id": 283,
   "type": "message",
   "date": "2016-12-09T21:18:38",
   "from": "Aufwachen",
   "from_id": 9683270591,
   "photo": "photos/photo_272@09-12-2016_21-18-38.jpg",
   "width": 552,
   "height": 669,
   "text": ""
  },
  {
   "id": 284,
   "type": "message",
   "date": "2016-12-09T21:19:08",
   "from": "Aufwachen",
   "from_id": 9683270591,
   "photo": "photos/photo_273@09-12-2016_21-19-08.jpg",
   "width": 720,
   "height": 540,
   "text": ""
  },
  {
   "id": 285,
   "type": "message",
   "date": "2016-12-09T21:19:39",
   "from": "Aufwachen",
   "from_id": 9683270591,
   "photo": "photos/photo_274@09-12-2016_21-19-39.jpg",
   "width": 720,
   "height": 720,
   "text": ""
  },
  {
   "id": 286,
   "type": "message",
   "date": "2016-12-09T21:20:25",
   "from": "Aufwachen",
   "from_id": 9683270591,
   "photo": "photos/photo_275@09-12-2016_21-20-25.jpg",
   "width": 700,
   "height": 934,
   "text": ""
  },
  {
   "id": 287,
   "type": "message",
   "date": "2016-12-09T21:20:59",
   "from": "Aufwachen",
   "from_id": 9683270591,
   "photo": "photos/photo_276@09-12-2016_21-20-59.jpg",
   "width": 526,
   "height": 526,
   "text": ""
  },
  {
   "id": 288,
   "type": "message",
   "date": "2016-12-09T21:22:43",
   "from": "Aufwachen",
   "from_id": 9683270591,
   "photo": "photos/photo_277@09-12-2016_21-22-43.jpg",
   "width": 595,
   "height": 398,
   "text": ""
  },
  {
   "id": 289,
   "type": "message",
   "date": "2016-12-09T21:23:09",
   "from": "Aufwachen",
   "from_id": 9683270591,
   "photo": "photos/photo_278@09-12-2016_21-23-09.jpg",
   "width": 600,
   "height": 390,
   "text": ""
  },
  {
   "id": 290,
   "type": "message",
   "date": "2016-12-09T21:23:52",
   "from": "Aufwachen",
   "from_id": 9683270591,
   "photo": "photos/photo_279@09-12-2016_21-23-52.jpg",
   "width": 720,
   "height": 720,
   "text": ""
  },
  {
   "id": 291,
   "type": "message",
   "date": "2016-12-09T21:28:31",
   "from": "Aufwachen",
   "from_id": 9683270591,
   "photo": "photos/photo_280@09-12-2016_21-28-31.jpg",
   "width": 480,
   "height": 683,
   "text": ""
  },
  {
   "id": 292,
   "type": "message",
   "date": "2016-12-09T21:28:56",
   "from": "Aufwachen",
   "from_id": 9683270591,
   "photo": "photos/photo_281@09-12-2016_21-28-56.jpg",
   "width": 480,
   "height": 478,
   "text": ""
  },
  {
   "id": 293,
   "type": "message",
   "date": "2016-12-09T21:30:49",
   "from": "Aufwachen",
   "from_id": 9683270591,
   "photo": "photos/photo_282@09-12-2016_21-30-49.jpg",
   "width": 720,
   "height": 720,
   "text": ""
  },
  {
   "id": 294,
   "type": "message",
   "date": "2016-12-09T21:31:48",
   "from": "Aufwachen",
   "from_id": 9683270591,
   "photo": "photos/photo_283@09-12-2016_21-31-48.jpg",
   "width": 480,
   "height": 300,
   "text": ""
  },
  {
   "id": 295,
   "type": "message",
   "date": "2016-12-09T21:33:47",
   "from": "Aufwachen",
   "from_id": 9683270591,
   "photo": "photos/photo_284@09-12-2016_21-33-47.jpg",
   "width": 534,
   "height": 702,
   "text": ""
  },
  {
   "id": 296,
   "type": "message",
   "date": "2016-12-09T21:35:14",
   "from": "Aufwachen",
   "from_id": 9683270591,
   "photo": "photos/photo_285@09-12-2016_21-35-14.jpg",
   "width": 623,
   "height": 623,
   "text": ""
  },
  {
   "id": 297,
   "type": "message",
   "date": "2016-12-09T21:36:38",
   "from": "Aufwachen",
   "from_id": 9683270591,
   "photo": "photos/photo_286@09-12-2016_21-36-38.jpg",
   "width": 480,
   "height": 342,
   "text": ""
  },
  {
   "id": 298,
   "type": "message",
   "date": "2016-12-09T21:38:22",
   "from": "Aufwachen",
   "from_id": 9683270591,
   "photo": "photos/photo_287@09-12-2016_21-38-22.jpg",
   "width": 720,
   "height": 579,
   "text": ""
  },
  {
   "id": 299,
   "type": "message",
   "date": "2016-12-09T21:38:54",
   "from": "Aufwachen",
   "from_id": 9683270591,
   "photo": "photos/photo_288@09-12-2016_21-38-54.jpg",
   "width": 720,
   "height": 1008,
   "text": ""
  },
  {
   "id": 300,
   "type": "message",
   "date": "2016-12-09T21:39:33",
   "from": "Aufwachen",
   "from_id": 9683270591,
   "photo": "photos/photo_289@09-12-2016_21-39-33.jpg",
   "width": 613,
   "height": 541,
   "text": ""
  },
  {
   "id": 301,
   "type": "message",
   "date": "2016-12-09T21:41:28",
   "from": "Aufwachen",
   "from_id": 9683270591,
   "photo": "photos/photo_290@09-12-2016_21-41-28.jpg",
   "width": 720,
   "height": 658,
   "text": ""
  },
  {
   "id": 302,
   "type": "message",
   "date": "2016-12-09T21:43:10",
   "from": "Aufwachen",
   "from_id": 9683270591,
   "photo": "photos/photo_291@09-12-2016_21-43-10.jpg",
   "width": 537,
   "height": 533,
   "text": ""
  },
  {
   "id": 303,
   "type": "message",
   "date": "2016-12-09T21:45:32",
   "from": "Aufwachen",
   "from_id": 9683270591,
   "photo": "photos/photo_292@09-12-2016_21-45-32.jpg",
   "width": 564,
   "height": 588,
   "text": ""
  },
  {
   "id": 304,
   "type": "message",
   "date": "2016-12-09T21:46:48",
   "from": "Aufwachen",
   "from_id": 9683270591,
   "photo": "photos/photo_293@09-12-2016_21-46-48.jpg",
   "width": 720,
   "height": 720,
   "text": ""
  },
  {
   "id": 305,
   "type": "message",
   "date": "2016-12-09T22:43:37",
   "from": "Aufwachen",
   "from_id": 9683270591,
   "photo": "photos/photo_294@09-12-2016_22-43-37.jpg",
   "width": 480,
   "height": 437,
   "text": ""
  },
  {
   "id": 306,
   "type": "message",
   "date": "2016-12-09T22:44:54",
   "from": "Aufwachen",
   "from_id": 9683270591,
   "photo": "photos/photo_295@09-12-2016_22-44-54.jpg",
   "width": 720,
   "height": 720,
   "text": ""
  },
  {
   "id": 307,
   "type": "message",
   "date": "2016-12-09T22:46:45",
   "from": "Aufwachen",
   "from_id": 9683270591,
   "photo": "photos/photo_296@09-12-2016_22-46-45.jpg",
   "width": 720,
   "height": 507,
   "text": ""
  },
  {
   "id": 308,
   "type": "message",
   "date": "2016-12-09T22:47:49",
   "from": "Aufwachen",
   "from_id": 9683270591,
   "photo": "photos/photo_297@09-12-2016_22-47-49.jpg",
   "width": 720,
   "height": 571,
   "text": ""
  },
  {
   "id": 309,
   "type": "message",
   "date": "2016-12-09T22:49:36",
   "from": "Aufwachen",
   "from_id": 9683270591,
   "photo": "photos/photo_298@09-12-2016_22-49-36.jpg",
   "width": 640,
   "height": 612,
   "text": ""
  },
  {
   "id": 310,
   "type": "message",
   "date": "2016-12-10T07:55:15",
   "from": "Aufwachen",
   "from_id": 9683270591,
   "photo": "photos/photo_299@10-12-2016_07-55-15.jpg",
   "width": 720,
   "height": 862,
   "text": ""
  },
  {
   "id": 311,
   "type": "message",
   "date": "2016-12-10T09:48:18",
   "from": "Aufwachen",
   "from_id": 9683270591,
   "photo": "photos/photo_300@10-12-2016_09-48-18.jpg",
   "width": 720,
   "height": 849,
   "text": ""
  },
  {
   "id": 312,
   "type": "message",
   "date": "2016-12-10T11:15:08",
   "from": "Aufwachen",
   "from_id": 9683270591,
   "photo": "photos/photo_301@10-12-2016_11-15-08.jpg",
   "width": 720,
   "height": 508,
   "text": ""
  },
  {
   "id": 313,
   "type": "message",
   "date": "2016-12-10T11:17:24",
   "from": "Aufwachen",
   "from_id": 9683270591,
   "photo": "photos/photo_302@10-12-2016_11-17-24.jpg",
   "width": 420,
   "height": 605,
   "text": ""
  },
  {
   "id": 314,
   "type": "message",
   "date": "2016-12-11T01:32:52",
   "from": "Aufwachen",
   "from_id": 9683270591,
   "photo": "photos/photo_303@11-12-2016_01-32-52.jpg",
   "width": 720,
   "height": 561,
   "text": ""
  },
  {
   "id": 315,
   "type": "message",
   "date": "2016-12-11T01:35:39",
   "from": "Aufwachen",
   "from_id": 9683270591,
   "photo": "photos/photo_304@11-12-2016_01-35-39.jpg",
   "width": 604,
   "height": 787,
   "text": ""
  },
  {
   "id": 316,
   "type": "message",
   "date": "2016-12-11T01:39:35",
   "from": "Aufwachen",
   "from_id": 9683270591,
   "photo": "photos/photo_305@11-12-2016_01-39-35.jpg",
   "width": 600,
   "height": 822,
   "text": ""
  },
  {
   "id": 317,
   "type": "message",
   "date": "2016-12-11T01:40:50",
   "from": "Aufwachen",
   "from_id": 9683270591,
   "photo": "photos/photo_306@11-12-2016_01-40-50.jpg",
   "width": 480,
   "height": 481,
   "text": ""
  },
  {
   "id": 318,
   "type": "message",
   "date": "2016-12-11T01:41:09",
   "from": "Aufwachen",
   "from_id": 9683270591,
   "photo": "photos/photo_307@11-12-2016_01-41-09.jpg",
   "width": 708,
   "height": 775,
   "text": ""
  },
  {
   "id": 319,
   "type": "message",
   "date": "2016-12-11T01:48:35",
   "from": "Aufwachen",
   "from_id": 9683270591,
   "photo": "photos/photo_308@11-12-2016_01-48-35.jpg",
   "width": 705,
   "height": 705,
   "text": ""
  },
  {
   "id": 320,
   "type": "message",
   "date": "2016-12-11T01:51:55",
   "from": "Aufwachen",
   "from_id": 9683270591,
   "photo": "photos/photo_309@11-12-2016_01-51-55.jpg",
   "width": 516,
   "height": 390,
   "text": ""
  },
  {
   "id": 321,
   "type": "message",
   "date": "2016-12-11T01:54:45",
   "from": "Aufwachen",
   "from_id": 9683270591,
   "photo": "photos/photo_310@11-12-2016_01-54-45.jpg",
   "width": 480,
   "height": 480,
   "text": ""
  },
  {
   "id": 322,
   "type": "message",
   "date": "2016-12-11T01:58:45",
   "from": "Aufwachen",
   "from_id": 9683270591,
   "photo": "photos/photo_311@11-12-2016_01-58-45.jpg",
   "width": 720,
   "height": 737,
   "text": ""
  },
  {
   "id": 323,
   "type": "message",
   "date": "2016-12-11T02:01:14",
   "from": "Aufwachen",
   "from_id": 9683270591,
   "photo": "photos/photo_312@11-12-2016_02-01-14.jpg",
   "width": 473,
   "height": 668,
   "text": ""
  },
  {
   "id": 324,
   "type": "message",
   "date": "2016-12-11T02:03:55",
   "from": "Aufwachen",
   "from_id": 9683270591,
   "photo": "photos/photo_313@11-12-2016_02-03-55.jpg",
   "width": 720,
   "height": 539,
   "text": ""
  },
  {
   "id": 325,
   "type": "message",
   "date": "2016-12-11T12:59:23",
   "from": "Aufwachen",
   "from_id": 9683270591,
   "photo": "photos/photo_314@11-12-2016_12-59-23.jpg",
   "width": 720,
   "height": 720,
   "text": ""
  },
  {
   "id": 326,
   "type": "message",
   "date": "2016-12-11T14:20:55",
   "from": "Aufwachen",
   "from_id": 9683270591,
   "photo": "photos/photo_315@11-12-2016_14-20-55.jpg",
   "width": 720,
   "height": 1008,
   "text": ""
  },
  {
   "id": 327,
   "type": "message",
   "date": "2016-12-11T17:06:20",
   "from": "Aufwachen",
   "from_id": 9683270591,
   "photo": "photos/photo_316@11-12-2016_17-06-20.jpg",
   "width": 720,
   "height": 652,
   "text": ""
  },
  {
   "id": 328,
   "type": "message",
   "date": "2016-12-11T18:17:42",
   "from": "Aufwachen",
   "from_id": 9683270591,
   "photo": "photos/photo_317@11-12-2016_18-17-42.jpg",
   "width": 720,
   "height": 720,
   "text": ""
  },
  {
   "id": 329,
   "type": "message",
   "date": "2016-12-11T18:21:10",
   "from": "Aufwachen",
   "from_id": 9683270591,
   "photo": "photos/photo_318@11-12-2016_18-21-10.jpg",
   "width": 471,
   "height": 720,
   "text": ""
  },
  {
   "id": 330,
   "type": "message",
   "date": "2016-12-11T18:22:28",
   "from": "Aufwachen",
   "from_id": 9683270591,
   "photo": "photos/photo_319@11-12-2016_18-22-28.jpg",
   "width": 604,
   "height": 580,
   "text": ""
  },
  {
   "id": 331,
   "type": "message",
   "date": "2016-12-11T19:13:50",
   "from": "Aufwachen",
   "from_id": 9683270591,
   "photo": "photos/photo_320@11-12-2016_19-13-50.jpg",
   "width": 720,
   "height": 720,
   "text": ""
  },
  {
   "id": 332,
   "type": "message",
   "date": "2016-12-11T19:16:59",
   "from": "Aufwachen",
   "from_id": 9683270591,
   "photo": "photos/photo_321@11-12-2016_19-16-59.jpg",
   "width": 720,
   "height": 773,
   "text": ""
  },
  {
   "id": 333,
   "type": "message",
   "date": "2016-12-11T20:25:41",
   "from": "Aufwachen",
   "from_id": 9683270591,
   "photo": "photos/photo_322@11-12-2016_20-25-41.jpg",
   "width": 570,
   "height": 575,
   "text": ""
  },
  {
   "id": 334,
   "type": "message",
   "date": "2016-12-12T06:54:56",
   "from": "Aufwachen",
   "from_id": 9683270591,
   "photo": "photos/photo_323@12-12-2016_06-54-56.jpg",
   "width": 600,
   "height": 600,
   "text": ""
  },
  {
   "id": 335,
   "type": "message",
   "date": "2016-12-12T12:42:13",
   "from": "Aufwachen",
   "from_id": 9683270591,
   "photo": "photos/photo_324@12-12-2016_12-42-13.jpg",
   "width": 600,
   "height": 600,
   "text": ""
  },
  {
   "id": 336,
   "type": "message",
   "date": "2016-12-12T12:42:50",
   "from": "Aufwachen",
   "from_id": 9683270591,
   "photo": "photos/photo_325@12-12-2016_12-42-50.jpg",
   "width": 720,
   "height": 720,
   "text": ""
  },
  {
   "id": 337,
   "type": "message",
   "date": "2016-12-12T12:43:40",
   "from": "Aufwachen",
   "from_id": 9683270591,
   "photo": "photos/photo_326@12-12-2016_12-43-40.jpg",
   "width": 720,
   "height": 720,
   "text": ""
  },
  {
   "id": 338,
   "type": "message",
   "date": "2016-12-12T12:46:06",
   "from": "Aufwachen",
   "from_id": 9683270591,
   "photo": "photos/photo_327@12-12-2016_12-46-06.jpg",
   "width": 480,
   "height": 480,
   "text": ""
  },
  {
   "id": 339,
   "type": "message",
   "date": "2016-12-12T17:40:43",
   "from": "Aufwachen",
   "from_id": 9683270591,
   "photo": "photos/photo_328@12-12-2016_17-40-43.jpg",
   "width": 720,
   "height": 720,
   "text": ""
  },
  {
   "id": 340,
   "type": "message",
   "date": "2016-12-12T18:59:20",
   "from": "Aufwachen",
   "from_id": 9683270591,
   "photo": "photos/photo_329@12-12-2016_18-59-20.jpg",
   "width": 720,
   "height": 720,
   "text": ""
  },
  {
   "id": 341,
   "type": "message",
   "date": "2016-12-12T19:26:43",
   "from": "Aufwachen",
   "from_id": 9683270591,
   "photo": "photos/photo_330@12-12-2016_19-26-43.jpg",
   "width": 400,
   "height": 400,
   "text": ""
  },
  {
   "id": 342,
   "type": "message",
   "date": "2016-12-12T20:20:21",
   "from": "Aufwachen",
   "from_id": 9683270591,
   "photo": "photos/photo_331@12-12-2016_20-20-21.jpg",
   "width": 480,
   "height": 621,
   "text": ""
  },
  {
   "id": 343,
   "type": "message",
   "date": "2016-12-12T21:28:54",
   "from": "Aufwachen",
   "from_id": 9683270591,
   "photo": "photos/photo_332@12-12-2016_21-28-54.jpg",
   "width": 584,
   "height": 711,
   "text": ""
  },
  {
   "id": 344,
   "type": "message",
   "date": "2016-12-12T21:37:00",
   "from": "Aufwachen",
   "from_id": 9683270591,
   "photo": "photos/photo_333@12-12-2016_21-37-00.jpg",
   "width": 540,
   "height": 960,
   "text": ""
  },
  {
   "id": 345,
   "type": "message",
   "date": "2016-12-13T22:24:24",
   "from": "Aufwachen",
   "from_id": 9683270591,
   "photo": "photos/photo_334@13-12-2016_22-24-24.jpg",
   "width": 720,
   "height": 784,
   "text": ""
  },
  {
   "id": 346,
   "type": "message",
   "date": "2016-12-13T22:26:46",
   "from": "Aufwachen",
   "from_id": 9683270591,
   "photo": "photos/photo_335@13-12-2016_22-26-46.jpg",
   "width": 615,
   "height": 566,
   "text": ""
  },
  {
   "id": 347,
   "type": "message",
   "date": "2016-12-13T22:28:07",
   "from": "Aufwachen",
   "from_id": 9683270591,
   "photo": "photos/photo_336@13-12-2016_22-28-07.jpg",
   "width": 582,
   "height": 767,
   "text": ""
  },
  {
   "id": 348,
   "type": "message",
   "date": "2016-12-13T22:28:44",
   "from": "Aufwachen",
   "from_id": 9683270591,
   "photo": "photos/photo_337@13-12-2016_22-28-44.jpg",
   "width": 720,
   "height": 874,
   "text": ""
  },
  {
   "id": 349,
   "type": "message",
   "date": "2016-12-13T22:31:42",
   "from": "Aufwachen",
   "from_id": 9683270591,
   "photo": "photos/photo_338@13-12-2016_22-31-42.jpg",
   "width": 650,
   "height": 431,
   "text": ""
  },
  {
   "id": 350,
   "type": "message",
   "date": "2016-12-13T22:32:49",
   "from": "Aufwachen",
   "from_id": 9683270591,
   "photo": "photos/photo_339@13-12-2016_22-32-49.jpg",
   "width": 720,
   "height": 720,
   "text": ""
  },
  {
   "id": 351,
   "type": "message",
   "date": "2016-12-13T22:33:49",
   "from": "Aufwachen",
   "from_id": 9683270591,
   "photo": "photos/photo_340@13-12-2016_22-33-49.jpg",
   "width": 454,
   "height": 510,
   "text": ""
  },
  {
   "id": 352,
   "type": "message",
   "date": "2016-12-13T22:34:23",
   "from": "Aufwachen",
   "from_id": 9683270591,
   "photo": "photos/photo_341@13-12-2016_22-34-23.jpg",
   "width": 720,
   "height": 720,
   "text": ""
  },
  {
   "id": 353,
   "type": "message",
   "date": "2016-12-13T22:36:43",
   "from": "Aufwachen",
   "from_id": 9683270591,
   "photo": "photos/photo_342@13-12-2016_22-36-43.jpg",
   "width": 720,
   "height": 542,
   "text": ""
  },
  {
   "id": 354,
   "type": "message",
   "date": "2016-12-13T22:44:31",
   "from": "Aufwachen",
   "from_id": 9683270591,
   "photo": "photos/photo_343@13-12-2016_22-44-31.jpg",
   "width": 720,
   "height": 1080,
   "text": ""
  },
  {
   "id": 355,
   "type": "message",
   "date": "2016-12-13T22:53:44",
   "from": "Aufwachen",
   "from_id": 9683270591,
   "photo": "photos/photo_344@13-12-2016_22-53-44.jpg",
   "width": 458,
   "height": 434,
   "text": ""
  },
  {
   "id": 356,
   "type": "message",
   "date": "2016-12-14T07:34:26",
   "from": "Aufwachen",
   "from_id": 9683270591,
   "photo": "photos/photo_345@14-12-2016_07-34-26.jpg",
   "width": 480,
   "height": 540,
   "text": ""
  },
  {
   "id": 357,
   "type": "message",
   "date": "2016-12-14T07:37:04",
   "from": "Aufwachen",
   "from_id": 9683270591,
   "photo": "photos/photo_346@14-12-2016_07-37-04.jpg",
   "width": 480,
   "height": 304,
   "text": ""
  },
  {
   "id": 358,
   "type": "message",
   "date": "2016-12-14T07:38:01",
   "from": "Aufwachen",
   "from_id": 9683270591,
   "photo": "photos/photo_347@14-12-2016_07-38-01.jpg",
   "width": 612,
   "height": 927,
   "text": ""
  },
  {
   "id": 359,
   "type": "message",
   "date": "2016-12-14T08:39:49",
   "from": "Aufwachen",
   "from_id": 9683270591,
   "photo": "photos/photo_348@14-12-2016_08-39-49.jpg",
   "width": 720,
   "height": 720,
   "text": ""
  },
  {
   "id": 360,
   "type": "message",
   "date": "2016-12-14T08:40:29",
   "from": "Aufwachen",
   "from_id": 9683270591,
   "photo": "photos/photo_349@14-12-2016_08-40-29.jpg",
   "width": 720,
   "height": 587,
   "text": ""
  },
  {
   "id": 361,
   "type": "message",
   "date": "2016-12-14T08:41:45",
   "from": "Aufwachen",
   "from_id": 9683270591,
   "photo": "photos/photo_350@14-12-2016_08-41-45.jpg",
   "width": 442,
   "height": 640,
   "text": ""
  },
  {
   "id": 362,
   "type": "message",
   "date": "2016-12-14T08:42:31",
   "from": "Aufwachen",
   "from_id": 9683270591,
   "photo": "photos/photo_351@14-12-2016_08-42-31.jpg",
   "width": 480,
   "height": 447,
   "text": ""
  },
  {
   "id": 363,
   "type": "message",
   "date": "2016-12-14T08:42:56",
   "from": "Aufwachen",
   "from_id": 9683270591,
   "photo": "photos/photo_352@14-12-2016_08-42-56.jpg",
   "width": 507,
   "height": 751,
   "text": ""
  },
  {
   "id": 364,
   "type": "message",
   "date": "2016-12-14T08:43:41",
   "from": "Aufwachen",
   "from_id": 9683270591,
   "photo": "photos/photo_353@14-12-2016_08-43-41.jpg",
   "width": 640,
   "height": 842,
   "text": ""
  },
  {
   "id": 365,
   "type": "message",
   "date": "2016-12-14T08:45:15",
   "from": "Aufwachen",
   "from_id": 9683270591,
   "photo": "photos/photo_354@14-12-2016_08-45-15.jpg",
   "width": 720,
   "height": 1018,
   "text": ""
  },
  {
   "id": 366,
   "type": "message",
   "date": "2016-12-14T09:26:24",
   "from": "Aufwachen",
   "from_id": 9683270591,
   "photo": "photos/photo_355@14-12-2016_09-26-24.jpg",
   "width": 720,
   "height": 720,
   "text": ""
  },
  {
   "id": 367,
   "type": "message",
   "date": "2016-12-14T09:29:19",
   "from": "Aufwachen",
   "from_id": 9683270591,
   "photo": "photos/photo_356@14-12-2016_09-29-19.jpg",
   "width": 600,
   "height": 533,
   "text": ""
  },
  {
   "id": 368,
   "type": "message",
   "date": "2016-12-14T09:30:10",
   "from": "Aufwachen",
   "from_id": 9683270591,
   "photo": "photos/photo_357@14-12-2016_09-30-10.jpg",
   "width": 600,
   "height": 600,
   "text": ""
  },
  {
   "id": 369,
   "type": "message",
   "date": "2016-12-14T09:31:25",
   "from": "Aufwachen",
   "from_id": 9683270591,
   "photo": "photos/photo_358@14-12-2016_09-31-25.jpg",
   "width": 639,
   "height": 960,
   "text": ""
  },
  {
   "id": 370,
   "type": "message",
   "date": "2016-12-14T13:01:30",
   "from": "Aufwachen",
   "from_id": 9683270591,
   "photo": "photos/photo_359@14-12-2016_13-01-30.jpg",
   "width": 720,
   "height": 677,
   "text": ""
  },
  {
   "id": 371,
   "type": "message",
   "date": "2016-12-14T14:00:42",
   "from": "Aufwachen",
   "from_id": 9683270591,
   "photo": "photos/photo_360@14-12-2016_14-00-42.jpg",
   "width": 720,
   "height": 516,
   "text": ""
  },
  {
   "id": 372,
   "type": "message",
   "date": "2016-12-14T15:14:52",
   "from": "Aufwachen",
   "from_id": 9683270591,
   "photo": "photos/photo_361@14-12-2016_15-14-52.jpg",
   "width": 720,
   "height": 720,
   "text": ""
  },
  {
   "id": 373,
   "type": "message",
   "date": "2016-12-14T20:28:52",
   "from": "Aufwachen",
   "from_id": 9683270591,
   "photo": "photos/photo_362@14-12-2016_20-28-52.jpg",
   "width": 720,
   "height": 720,
   "text": ""
  },
  {
   "id": 374,
   "type": "message",
   "date": "2016-12-14T20:32:24",
   "from": "Aufwachen",
   "from_id": 9683270591,
   "photo": "photos/photo_363@14-12-2016_20-32-24.jpg",
   "width": 720,
   "height": 720,
   "text": ""
  },
  {
   "id": 375,
   "type": "message",
   "date": "2016-12-14T20:33:18",
   "from": "Aufwachen",
   "from_id": 9683270591,
   "photo": "photos/photo_364@14-12-2016_20-33-18.jpg",
   "width": 720,
   "height": 720,
   "text": ""
  },
  {
   "id": 376,
   "type": "message",
   "date": "2016-12-14T20:35:05",
   "from": "Aufwachen",
   "from_id": 9683270591,
   "photo": "photos/photo_365@14-12-2016_20-35-05.jpg",
   "width": 412,
   "height": 395,
   "text": ""
  },
  {
   "id": 377,
   "type": "message",
   "date": "2016-12-14T21:17:03",
   "from": "Aufwachen",
   "from_id": 9683270591,
   "photo": "photos/photo_366@14-12-2016_21-17-03.jpg",
   "width": 500,
   "height": 731,
   "text": ""
  },
  {
   "id": 378,
   "type": "message",
   "date": "2016-12-14T21:18:42",
   "from": "Aufwachen",
   "from_id": 9683270591,
   "photo": "photos/photo_367@14-12-2016_21-18-42.jpg",
   "width": 445,
   "height": 395,
   "text": ""
  },
  {
   "id": 379,
   "type": "message",
   "date": "2016-12-14T21:23:33",
   "from": "Aufwachen",
   "from_id": 9683270591,
   "photo": "photos/photo_368@14-12-2016_21-23-33.jpg",
   "width": 720,
   "height": 720,
   "text": ""
  },
  {
   "id": 380,
   "type": "message",
   "date": "2016-12-15T06:56:05",
   "from": "Aufwachen",
   "from_id": 9683270591,
   "photo": "photos/photo_369@15-12-2016_06-56-05.jpg",
   "width": 720,
   "height": 715,
   "text": ""
  },
  {
   "id": 381,
   "type": "message",
   "date": "2016-12-15T08:42:25",
   "from": "Aufwachen",
   "from_id": 9683270591,
   "photo": "photos/photo_370@15-12-2016_08-42-25.jpg",
   "width": 720,
   "height": 783,
   "text": ""
  },
  {
   "id": 382,
   "type": "message",
   "date": "2016-12-15T09:43:08",
   "from": "Aufwachen",
   "from_id": 9683270591,
   "photo": "photos/photo_371@15-12-2016_09-43-08.jpg",
   "width": 720,
   "height": 720,
   "text": ""
  },
  {
   "id": 383,
   "type": "message",
   "date": "2016-12-15T10:48:34",
   "from": "Aufwachen",
   "from_id": 9683270591,
   "photo": "photos/photo_372@15-12-2016_10-48-34.jpg",
   "width": 720,
   "height": 720,
   "text": ""
  },
  {
   "id": 384,
   "type": "message",
   "date": "2016-12-15T13:00:30",
   "from": "Aufwachen",
   "from_id": 9683270591,
   "photo": "photos/photo_373@15-12-2016_13-00-30.jpg",
   "width": 720,
   "height": 713,
   "text": ""
  },
  {
   "id": 385,
   "type": "message",
   "date": "2016-12-15T14:39:08",
   "from": "Aufwachen",
   "from_id": 9683270591,
   "photo": "photos/photo_374@15-12-2016_14-39-08.jpg",
   "width": 668,
   "height": 848,
   "text": ""
  },
  {
   "id": 386,
   "type": "message",
   "date": "2016-12-15T14:40:51",
   "from": "Aufwachen",
   "from_id": 9683270591,
   "photo": "photos/photo_375@15-12-2016_14-40-51.jpg",
   "width": 720,
   "height": 805,
   "text": ""
  },
  {
   "id": 387,
   "type": "message",
   "date": "2016-12-15T14:41:53",
   "from": "Aufwachen",
   "from_id": 9683270591,
   "photo": "photos/photo_376@15-12-2016_14-41-53.jpg",
   "width": 499,
   "height": 621,
   "text": ""
  },
  {
   "id": 388,
   "type": "message",
   "date": "2016-12-15T16:18:00",
   "from": "Aufwachen",
   "from_id": 9683270591,
   "photo": "photos/photo_377@15-12-2016_16-18-00.jpg",
   "width": 720,
   "height": 720,
   "text": ""
  },
  {
   "id": 389,
   "type": "message",
   "date": "2016-12-15T16:19:42",
   "from": "Aufwachen",
   "from_id": 9683270591,
   "photo": "photos/photo_378@15-12-2016_16-19-42.jpg",
   "width": 720,
   "height": 446,
   "text": ""
  },
  {
   "id": 390,
   "type": "message",
   "date": "2016-12-15T16:20:40",
   "from": "Aufwachen",
   "from_id": 9683270591,
   "photo": "photos/photo_379@15-12-2016_16-20-40.jpg",
   "width": 720,
   "height": 508,
   "text": ""
  },
  {
   "id": 391,
   "type": "message",
   "date": "2016-12-15T16:22:45",
   "from": "Aufwachen",
   "from_id": 9683270591,
   "photo": "photos/photo_380@15-12-2016_16-22-45.jpg",
   "width": 400,
   "height": 374,
   "text": ""
  },
  {
   "id": 392,
   "type": "message",
   "date": "2016-12-15T16:23:33",
   "from": "Aufwachen",
   "from_id": 9683270591,
   "photo": "photos/photo_381@15-12-2016_16-23-33.jpg",
   "width": 720,
   "height": 762,
   "text": ""
  },
  {
   "id": 393,
   "type": "message",
   "date": "2016-12-15T18:20:34",
   "from": "Aufwachen",
   "from_id": 9683270591,
   "photo": "photos/photo_382@15-12-2016_18-20-34.jpg",
   "width": 281,
   "height": 269,
   "text": ""
  },
  {
   "id": 394,
   "type": "message",
   "date": "2016-12-15T18:21:50",
   "from": "Aufwachen",
   "from_id": 9683270591,
   "photo": "photos/photo_383@15-12-2016_18-21-50.jpg",
   "width": 640,
   "height": 444,
   "text": ""
  },
  {
   "id": 395,
   "type": "message",
   "date": "2016-12-15T18:25:05",
   "from": "Aufwachen",
   "from_id": 9683270591,
   "photo": "photos/photo_384@15-12-2016_18-25-05.jpg",
   "width": 720,
   "height": 720,
   "text": ""
  },
  {
   "id": 396,
   "type": "message",
   "date": "2016-12-15T19:05:21",
   "from": "Aufwachen",
   "from_id": 9683270591,
   "photo": "photos/photo_385@15-12-2016_19-05-21.jpg",
   "width": 480,
   "height": 383,
   "text": ""
  },
  {
   "id": 397,
   "type": "message",
   "date": "2016-12-15T22:36:28",
   "from": "Aufwachen",
   "from_id": 9683270591,
   "photo": "photos/photo_386@15-12-2016_22-36-28.jpg",
   "width": 480,
   "height": 640,
   "text": ""
  },
  {
   "id": 398,
   "type": "message",
   "date": "2016-12-16T10:38:02",
   "from": "Aufwachen",
   "from_id": 9683270591,
   "photo": "photos/photo_387@16-12-2016_10-38-02.jpg",
   "width": 516,
   "height": 766,
   "text": ""
  },
  {
   "id": 399,
   "type": "message",
   "date": "2016-12-16T10:42:31",
   "from": "Aufwachen",
   "from_id": 9683270591,
   "photo": "photos/photo_388@16-12-2016_10-42-31.jpg",
   "width": 480,
   "height": 480,
   "text": ""
  },
  {
   "id": 400,
   "type": "message",
   "date": "2016-12-16T13:21:28",
   "from": "Aufwachen",
   "from_id": 9683270591,
   "forwarded_from": null,
   "photo": "photos/photo_389@16-12-2016_13-21-28.jpg",
   "width": 600,
   "height": 375,
   "text": "Morjen zusammen "
  },
  {
   "id": 401,
   "type": "message",
   "date": "2016-12-16T15:04:01",
   "from": "Aufwachen",
   "from_id": 9683270591,
   "photo": "photos/photo_390@16-12-2016_15-04-01.jpg",
   "width": 620,
   "height": 1049,
   "text": ""
  },
  {
   "id": 402,
   "type": "message",
   "date": "2016-12-16T15:04:14",
   "from": "Aufwachen",
   "from_id": 9683270591,
   "photo": "photos/photo_391@16-12-2016_15-04-14.jpg",
   "width": 403,
   "height": 402,
   "text": ""
  },
  {
   "id": 403,
   "type": "message",
   "date": "2016-12-16T15:04:48",
   "from": "Aufwachen",
   "from_id": 9683270591,
   "photo": "photos/photo_392@16-12-2016_15-04-48.jpg",
   "width": 720,
   "height": 720,
   "text": ""
  },
  {
   "id": 404,
   "type": "message",
   "date": "2016-12-16T15:06:13",
   "from": "Aufwachen",
   "from_id": 9683270591,
   "photo": "photos/photo_393@16-12-2016_15-06-13.jpg",
   "width": 720,
   "height": 720,
   "text": ""
  },
  {
   "id": 405,
   "type": "message",
   "date": "2016-12-16T15:06:38",
   "from": "Aufwachen",
   "from_id": 9683270591,
   "photo": "photos/photo_394@16-12-2016_15-06-38.jpg",
   "width": 720,
   "height": 719,
   "text": ""
  },
  {
   "id": 406,
   "type": "message",
   "date": "2016-12-16T15:43:56",
   "from": "Aufwachen",
   "from_id": 9683270591,
   "photo": "photos/photo_395@16-12-2016_15-43-56.jpg",
   "width": 720,
   "height": 405,
   "text": ""
  },
  {
   "id": 407,
   "type": "message",
   "date": "2016-12-16T15:45:26",
   "from": "Aufwachen",
   "from_id": 9683270591,
   "photo": "photos/photo_396@16-12-2016_15-45-26.jpg",
   "width": 470,
   "height": 414,
   "text": ""
  },
  {
   "id": 408,
   "type": "message",
   "date": "2016-12-16T17:24:06",
   "from": "Aufwachen",
   "from_id": 9683270591,
   "photo": "photos/photo_397@16-12-2016_17-24-06.jpg",
   "width": 720,
   "height": 720,
   "text": ""
  },
  {
   "id": 409,
   "type": "message",
   "date": "2016-12-16T18:12:58",
   "from": "Aufwachen",
   "from_id": 9683270591,
   "photo": "photos/photo_398@16-12-2016_18-12-58.jpg",
   "width": 650,
   "height": 960,
   "text": ""
  },
  {
   "id": 410,
   "type": "message",
   "date": "2016-12-16T18:14:01",
   "from": "Aufwachen",
   "from_id": 9683270591,
   "photo": "photos/photo_399@16-12-2016_18-14-01.jpg",
   "width": 720,
   "height": 720,
   "text": ""
  },
  {
   "id": 411,
   "type": "message",
   "date": "2016-12-16T19:28:12",
   "from": "Aufwachen",
   "from_id": 9683270591,
   "photo": "photos/photo_400@16-12-2016_19-28-12.jpg",
   "width": 579,
   "height": 441,
   "text": ""
  },
  {
   "id": 412,
   "type": "message",
   "date": "2016-12-16T20:40:25",
   "from": "Aufwachen",
   "from_id": 9683270591,
   "photo": "photos/photo_401@16-12-2016_20-40-25.jpg",
   "width": 720,
   "height": 639,
   "text": ""
  },
  {
   "id": 413,
   "type": "message",
   "date": "2016-12-17T07:16:30",
   "from": "Aufwachen",
   "from_id": 9683270591,
   "photo": "photos/photo_402@17-12-2016_07-16-30.jpg",
   "width": 640,
   "height": 640,
   "text": ""
  },
  {
   "id": 414,
   "type": "message",
   "date": "2016-12-17T07:48:16",
   "from": "Aufwachen",
   "from_id": 9683270591,
   "photo": "photos/photo_403@17-12-2016_07-48-16.jpg",
   "width": 720,
   "height": 426,
   "text": ""
  },
  {
   "id": 415,
   "type": "message",
   "date": "2016-12-17T07:53:10",
   "from": "Aufwachen",
   "from_id": 9683270591,
   "photo": "photos/photo_404@17-12-2016_07-53-10.jpg",
   "width": 720,
   "height": 540,
   "text": ""
  },
  {
   "id": 416,
   "type": "message",
   "date": "2016-12-17T07:56:20",
   "from": "Aufwachen",
   "from_id": 9683270591,
   "photo": "photos/photo_405@17-12-2016_07-56-20.jpg",
   "width": 604,
   "height": 475,
   "text": ""
  },
  {
   "id": 417,
   "type": "message",
   "date": "2016-12-17T08:43:16",
   "from": "Aufwachen",
   "from_id": 9683270591,
   "photo": "photos/photo_406@17-12-2016_08-43-16.jpg",
   "width": 480,
   "height": 480,
   "text": ""
  },
  {
   "id": 418,
   "type": "message",
   "date": "2016-12-17T09:49:55",
   "from": "Aufwachen",
   "from_id": 9683270591,
   "photo": "photos/photo_407@17-12-2016_09-49-55.jpg",
   "width": 720,
   "height": 496,
   "text": ""
  },
  {
   "id": 419,
   "type": "message",
   "date": "2016-12-17T09:50:29",
   "from": "Aufwachen",
   "from_id": 9683270591,
   "photo": "photos/photo_408@17-12-2016_09-50-29.jpg",
   "width": 720,
   "height": 511,
   "text": ""
  },
  {
   "id": 420,
   "type": "message",
   "date": "2016-12-17T09:52:07",
   "from": "Aufwachen",
   "from_id": 9683270591,
   "photo": "photos/photo_409@17-12-2016_09-52-07.jpg",
   "width": 472,
   "height": 315,
   "text": ""
  },
  {
   "id": 421,
   "type": "message",
   "date": "2016-12-17T10:19:42",
   "from": "Aufwachen",
   "from_id": 9683270591,
   "photo": "photos/photo_410@17-12-2016_10-19-42.jpg",
   "width": 526,
   "height": 526,
   "text": ""
  },
  {
   "id": 422,
   "type": "message",
   "date": "2016-12-17T13:40:12",
   "from": "Aufwachen",
   "from_id": 9683270591,
   "photo": "photos/photo_411@17-12-2016_13-40-12.jpg",
   "width": 474,
   "height": 329,
   "text": ""
  },
  {
   "id": 423,
   "type": "message",
   "date": "2016-12-17T15:14:20",
   "from": "Aufwachen",
   "from_id": 9683270591,
   "photo": "photos/photo_412@17-12-2016_15-14-20.jpg",
   "width": 720,
   "height": 612,
   "text": ""
  },
  {
   "id": 424,
   "type": "message",
   "date": "2016-12-17T15:16:38",
   "from": "Aufwachen",
   "from_id": 9683270591,
   "photo": "photos/photo_413@17-12-2016_15-16-38.jpg",
   "width": 720,
   "height": 690,
   "text": ""
  },
  {
   "id": 425,
   "type": "message",
   "date": "2016-12-17T15:18:52",
   "from": "Aufwachen",
   "from_id": 9683270591,
   "photo": "photos/photo_414@17-12-2016_15-18-52.jpg",
   "width": 720,
   "height": 762,
   "text": ""
  },
  {
   "id": 426,
   "type": "message",
   "date": "2016-12-17T15:19:16",
   "from": "Aufwachen",
   "from_id": 9683270591,
   "photo": "photos/photo_415@17-12-2016_15-19-16.jpg",
   "width": 600,
   "height": 450,
   "text": ""
  },
  {
   "id": 427,
   "type": "message",
   "date": "2016-12-17T15:21:10",
   "from": "Aufwachen",
   "from_id": 9683270591,
   "photo": "photos/photo_416@17-12-2016_15-21-10.jpg",
   "width": 672,
   "height": 646,
   "text": ""
  },
  {
   "id": 428,
   "type": "message",
   "date": "2016-12-17T16:40:38",
   "from": "Aufwachen",
   "from_id": 9683270591,
   "photo": "photos/photo_417@17-12-2016_16-40-38.jpg",
   "width": 491,
   "height": 260,
   "text": ""
  },
  {
   "id": 429,
   "type": "message",
   "date": "2016-12-17T17:43:35",
   "from": "Aufwachen",
   "from_id": 9683270591,
   "photo": "photos/photo_418@17-12-2016_17-43-35.jpg",
   "width": 705,
   "height": 705,
   "text": ""
  },
  {
   "id": 430,
   "type": "message",
   "date": "2016-12-17T19:04:10",
   "from": "Aufwachen",
   "from_id": 9683270591,
   "photo": "photos/photo_419@17-12-2016_19-04-10.jpg",
   "width": 660,
   "height": 592,
   "text": ""
  },
  {
   "id": 431,
   "type": "message",
   "date": "2016-12-17T21:31:51",
   "from": "Aufwachen",
   "from_id": 9683270591,
   "photo": "photos/photo_420@17-12-2016_21-31-51.jpg",
   "width": 700,
   "height": 700,
   "text": ""
  },
  {
